id,name,screen_name,profile_url,profile_image,description,location,url,followers_count,following_count,statuses_count,created_at,batch
872538350,Healing Ireland,healingireland,https://twitter.com/healingireland,https://si0.twimg.com/profile_images/2703171141/5b88352e0e6065133aeda903aca2c8c9_normal.jpeg,If you think you have been sexually assaulted or raped please contact us for completely confidential help. We will respond to any DM or email. Address below.,,,67,237,10,2012-10-10 21:35:03+00:00,1
497044733,Meadhbh Foster,mbopf,https://twitter.com/mbopf,https://si0.twimg.com/profile_images/1838550586/mbop_normal.jpg,,Dublin,,65,138,136,2012-02-19 15:15:34+00:00,1
414097079,Oxygen.ie,Oxygen_IE,https://twitter.com/Oxygen_IE,https://si0.twimg.com/profile_images/1642304430/Oxygen-logo_normal.jpg,Oxygen.ie is Ireland's No 1 student website for everything student related and loadsa other cool stuff....,,http://t.co/B4QmeRRZLp,209,644,531,2011-11-16 16:40:06+00:00,1
266791447, Steve Wrenn ,WrennSteve,https://twitter.com/WrennSteve,https://si0.twimg.com/profile_images/378800000460500994/2a031ef62d72e0fdd60894c539502dc5_normal.jpeg,"Loves food, travel, radio and fishing. Has rediscovered a love for running and music",Dublin City ,,753,1812,376,2011-03-15 20:38:12+00:00,1
865005097,Sabrina Duncan,sabrinaduncan_,https://twitter.com/sabrinaduncan_,https://si0.twimg.com/profile_images/378800000304522158/85e6889c6f39a579f3e79aeb7b8edb12_normal.jpeg,"The truth, the whole truth and nothing but the truth. 

Lead me not into temptation, I know my own way, thanks.",Galway,,213,211,12580,2012-10-06 17:11:50+00:00,1
296075936,Susan Buckley,SuBuckley,https://twitter.com/SuBuckley,https://si0.twimg.com/profile_images/378800000443942468/cf749eb11e1b0752046d57bb0e8d410c_normal.jpeg,"Seize the day or seize up, life is for living. Full time working and part time studying single Mum to two teens. Live in Bray, Ireland. Here for the craic :)",Bray,,1391,1891,27806,2011-05-10 04:49:06+00:00,1
109410418,FixMyArea,FixMyArea,https://twitter.com/FixMyArea,https://si0.twimg.com/profile_images/1833276455/logo_twitter_normal.png,"FixMyArea is the new way of taking care of your area without breaking a sweat. Spotted a problem? Open the app, snap a pic, and let us take care of the rest!",Ireland,http://t.co/MXVOgbggHm,296,843,147,2010-01-28 23:46:51+00:00,1
18486291,Vampy,vampybabe,https://twitter.com/vampybabe,https://si0.twimg.com/profile_images/3712322151/cf88d468abbada1f2664010e866e0895_normal.jpeg,You can't take the sky from me,,,1063,857,64887,2008-12-30 19:58:04+00:00,1
45106344,JC,jc_ie,https://twitter.com/jc_ie,https://si0.twimg.com/profile_images/3083377039/945e503cfaa207e4ec7430fa949d066f_normal.jpeg,Based in Maynooth. Work in IFSC. Student of DCU/UCD (TCD according to my Student Travel card). On an eternal quest for more(or any..) free time...,Maynooth,,548,1170,31980,2009-06-06 10:28:57+00:00,1
57371522,arlette lyons,Arlettemlyons,https://twitter.com/Arlettemlyons,https://si0.twimg.com/profile_images/2663296615/2e9f84ca14945ae2c6ab8529d5079ead_normal.jpeg,I am a mum to 2 boys and a campaigner for TFMR Ireland all tweets are my personal view due baby no 4 soon never forgetting our baby Skye,,,437,999,393,2009-07-16 16:14:33+00:00,1
45677045,Brendan Murray,brendanamurray,https://twitter.com/brendanamurray,https://si0.twimg.com/profile_images/1507082378/Lighthouse_normal.jpg,Not selling or really wanting to buy. Log in when I can.,Dublin Ireland,,108,687,58,2009-06-08 21:32:31+00:00,1
724584685,Trans* Ireland,TransIreland,https://twitter.com/TransIreland,https://si0.twimg.com/profile_images/2649354404/c04d531b8f0143e829faf8707c13ab76_normal.jpeg,"Voluntary grass roots community collective working collaboratively to support, engage and empower the trans* community in Ireland.",Ireland,http://t.co/iebsdVlabG,795,1620,871,2012-07-29 20:25:59+00:00,1
10814042,Labour Youth,labouryouth,https://twitter.com/labouryouth,https://si0.twimg.com/profile_images/2506918666/iupe5bikhao7fb91cwyz_normal.jpeg,"Is é Óige an Lucht Oibre an eite de Pháirtí an Lucht Oibre don t-aos óg.  

Labour Youth is the youth wing of the Irish Labour Party.",Ireland,http://t.co/p9GLXxv1DG,2217,1291,2912,2007-12-03 16:17:10+00:00,1
761676510,Designs From Hell,DesignsFromHell,https://twitter.com/DesignsFromHell,https://si0.twimg.com/profile_images/2511292691/DFH_logo2_normal.png,"Examples of the bad, the ugly, and the terrible in web & graphic design",,http://t.co/3bqrDuqQyc,674,1792,283,2012-08-16 14:42:21+00:00,1
166149584,Christian Talbot,TheTall_Bot,https://twitter.com/TheTall_Bot,https://si0.twimg.com/profile_images/378800000487703371/6aab17e6e034b6607ec503c4a299788c_normal.jpeg,Overly sensitive. Bored easily. Making the worst of a good situation. Sometimes does stand-up comedy.,Ireland,http://t.co/G8mMyYw6Wl,490,433,5444,2010-07-13 13:10:30+00:00,1
112454683,Skinny Doll,theskinnydoll,https://twitter.com/theskinnydoll,https://si0.twimg.com/profile_images/378800000216235132/748bfe331e7c56ae170c1572e260a25d_normal.jpeg,A Doll from Down Under with a passion for rugby! WW SUPERFAN. Known to be a bit of a giggler...Here for fun & motivation! Be nice!,Ireland,http://t.co/9ujOn3LflN,2451,2376,58843,2010-02-08 15:19:17+00:00,1
173574761,Maggie Paige,Maggie_Paige,https://twitter.com/Maggie_Paige,https://si0.twimg.com/profile_images/2694701186/8acb6aa68104f66226bdc93820d6b082_normal.jpeg,Crazy girl with crazy ambition; lovin music and covered in ink........... And model with aspirations of decadence........,"Dublin, ",,169,257,66,2010-08-01 20:55:44+00:00,1
61733316,DIT's Matures,ditsmatures,https://twitter.com/ditsmatures,https://si0.twimg.com/profile_images/340961728/ditLogo_normal.gif,DIT's Mature Student Service is here to help! Follow us for regular updates.,"DIT, Dublin",http://t.co/v8mquy2POF,259,95,224,2009-07-31 09:21:11+00:00,1
822028040,Sarah Redmond,Sarah_Vixyn,https://twitter.com/Sarah_Vixyn,https://si0.twimg.com/profile_images/2606415627/301911_10150925877990438_545020437_21561452_1506014822_n_normal.jpg,Hello world!,,,53,31,26,2012-09-13 19:05:16+00:00,1
815712715,Speed Hating,SpeedHatingIre,https://twitter.com/SpeedHatingIre,https://si0.twimg.com/profile_images/2596746060/vyaypoptbkqnrsraxq14_normal.jpeg,"Speed HATING, a fun playful twist on the Speed Dating event. Psychologists have proven we bond more with people by sharing what we HATE!!",Dublin,http://t.co/2CK4JFd3JF,10,61,20,2012-09-10 17:54:36+00:00,1
19334486,98FM,98FM,https://twitter.com/98FM,https://si0.twimg.com/profile_images/3675734524/3e95ba20a391554783ac54aa6b425e2e_normal.jpeg,"We are 98FM - Dublin's Best Music Mix
Home of The Ray Foley Show and Dermot & Dave!","Dublin, Ireland",http://t.co/QtSO7b8nrP,41503,28240,28579,2009-01-22 11:12:48+00:00,1
38224461,LoveMusicHateRacism,lmhrireland,https://twitter.com/lmhrireland,https://si0.twimg.com/profile_images/2393876062/ibymzlzcxlfdyphxqx1l_normal.jpeg,Love Music Hate Racism at Indiependence Music Festival 2012 - Check our facebook for details.,Ireland,http://t.co/bwHFOabLYj,690,814,2400,2009-05-06 17:06:20+00:00,1
271407395,opposable thumbs,opposablethumb_,https://twitter.com/opposablethumb_,https://si0.twimg.com/profile_images/2602162549/iwg02f1ee9vpusw1lu8o_normal.jpeg,Just your friendly neighborhood Web Designer.1993 Slógadh winner. I also make a mean cup of coffee,"Dublin, Ireland",http://t.co/Ll1iBwnGQ7,261,800,2817,2011-03-24 13:03:27+00:00,1
517922724,FixMyStreet Ireland,FixMySt,https://twitter.com/FixMySt,https://si0.twimg.com/profile_images/2388656149/978ydu9lkr5xslb804is_normal.png,Questions? Send 'em to @handelaar,Ireland,http://t.co/jDfIdBGl40,155,133,57,2012-03-07 20:44:04+00:00,1
408818356,elaine,laineyorgill,https://twitter.com/laineyorgill,https://si0.twimg.com/profile_images/3618230917/2baaca82f87afe86585cd02c2734039e_normal.jpeg,"Irish girl taking my chances across the water, im blamining it on marrying an english man!!",manchester ,,346,405,10606,2011-11-09 22:49:11+00:00,1
152642086,The Quietman,rctwilkinson,https://twitter.com/rctwilkinson,https://si0.twimg.com/profile_images/378800000005222989/f1ed31a0f4153e83d1fc58da9a89296d_normal.png,"Eclectic music taste. Love all to do with radio. GAA, rugby & Spurs FC fan. Married to the beautiful Sharon. Gardener & cook. Specialist Palliative Care Nurse.","Leinster, Ireland",http://t.co/fkqBMpzRCK,638,1783,12469,2010-06-06 14:03:02+00:00,1
750136992,graftondavey,graftondavey,https://twitter.com/graftondavey,https://si0.twimg.com/profile_images/2525670329/nz5pbnwujny0md1h96ar_normal.jpeg,If I'm not on your timeline you might just miss a nugget or two.,Ireland,,338,1362,484,2012-08-10 22:07:27+00:00,1
261835505,Pilates for Life ,eithnepilates,https://twitter.com/eithnepilates,https://si0.twimg.com/profile_images/2439274572/0rdwfqumlbf9b38jqmjq_normal.jpeg,"Eithne is a fully qualified Pilates Instructor who has been instructing Pilates classes for over five years. Classes include: mat, pre-natal & swiss ball","Newbridge, Co Kildare",http://t.co/eGb8BF7BY9,102,259,92,2011-03-06 20:15:02+00:00,1
221752680,Elaine Keogh,elainekeogh10,https://twitter.com/elainekeogh10,https://si0.twimg.com/profile_images/1180979903/solstice_sunrise_normal.jpg,journalist,North East,,621,1494,479,2010-12-01 14:28:34+00:00,1
234943825,Sarah O'Riordan,yummynom,https://twitter.com/yummynom,https://si0.twimg.com/profile_images/3746210965/afcf02aec1070846cb425a3a0948b314_normal.jpeg,"A 23 year old fanatic foodie, turned food blogger. Blessed with the gift of the gab! I rarely shut up! Married to @thatoriordanlad","Athy, County Kildare, Ireland",http://t.co/EEhJFS91M7,1015,1462,6241,2011-01-06 23:53:17+00:00,1
16353454,Andy Harris,AndyHarrisVMI04,https://twitter.com/AndyHarrisVMI04,https://si0.twimg.com/profile_images/3442180510/570fedfed2209eb6d5e7409fc9221fe5_normal.jpeg,"Former DC transient & returned Austinite; 2X Iraq Veteran, Proud Democrat, VMI and GWU Alum; TX Longhorns & long suffering Cubs fan- trust me it works","Austin, Texas",,324,1988,534,2008-09-18 21:18:43+00:00,1
48503681,tabithamagazine,tabithamagazine,https://twitter.com/tabithamagazine,https://si0.twimg.com/profile_images/3687334234/11e1ff2982ee80ed0c50d437d1c997f5_normal.jpeg,Editors of Tabitha magazine. http://t.co/X7IsK4fNI8,ireland,,1215,1991,2069,2009-06-18 21:50:57+00:00,1
460028768,Charlotte Flood,FloodyCov,https://twitter.com/FloodyCov,https://si0.twimg.com/profile_images/3192290573/916ecdae6cbd46a6b792aa927d72b55f_normal.jpeg,"Cov lass, not fond of rhubarb. Producer of Joe and Keith, weekdays from 7am on Phantom 105.2.","Dublin, Ireland",,954,702,1068,2012-01-10 09:28:00+00:00,1
412415898,Catherine sullivan,1catsully,https://twitter.com/1catsully,https://si0.twimg.com/profile_images/1639782108/image_normal.jpg,"I'm a proud Irish-American. I live to travel back to Ireland every year, cant get enough of Eire. I'm a big U-2 fan as well, i love my dog and cats too","irwin,pa",,238,853,870,2011-11-14 17:18:32+00:00,1
45554839,Emma Dunphy,demosthenes09,https://twitter.com/demosthenes09,https://si0.twimg.com/profile_images/1893773817/kar626926839_1010875_2808_n_normal.jpg,,never certain,,52,214,100,2009-06-08 12:33:19+00:00,1
6886172,Fiona ON,famron,https://twitter.com/famron,https://si0.twimg.com/profile_images/1914272244/Spring-Flowers_normal.jpg,"Music, plants, animals. Runs a couple of miles the odd time.","Cork, Ireland",,480,1250,7283,2007-06-18 08:28:02+00:00,1
116891306,Noreen Kehoe,NoreenKehoe,https://twitter.com/NoreenKehoe,https://si0.twimg.com/profile_images/1878955397/photo_1_normal.PNG,Wexican working in the Pale. Am happy as Larry! All views my own unless I have stolen them off someone else......,"Dublin, Ireland",,375,644,3561,2010-02-23 22:20:40+00:00,1
239670829,Ron Culley,Iblogtoglasgow,https://twitter.com/Iblogtoglasgow,https://si0.twimg.com/profile_images/1662390749/ron_culley_normal.jpg,"Published author & playwright. Historical Fiction, Humour & Glaswegiana. Passionate about Glasgow, Scotland and Ireland. On the left. Convivial kind of fellah!","Glasgow, Scotland",http://t.co/co2ZZCLJos,6202,5355,3740,2011-01-18 04:33:48+00:00,1
401752179,An Ronandustigh,ronandusty,https://twitter.com/ronandusty,https://si0.twimg.com/profile_images/378800000468442555/7e7ca98a42991613715c1995d9c770d9_normal.jpeg,"I like films, cycling and beer. I want to see more of the world. Give me money so i can. Oh and i also completed the Snow Brothers arcade game once.",Luimneach,,363,268,29717,2011-10-31 01:22:02+00:00,1
26849753,stephen carlin,stephencarlin,https://twitter.com/stephencarlin,https://si0.twimg.com/profile_images/378800000429560748/86b8c2273fb8acc74578520763e89157_normal.jpeg,"gamer,geek, horror fan,works in IT, lives by the sea with cats and rabbits, atheist, vegetarian, skeptic. hail to the king baby!",Hove and Brighton,http://t.co/BVwtkgNSbN,595,373,60737,2009-03-26 21:00:59+00:00,1
304444367,leslierahye,leslierahye,https://twitter.com/leslierahye,https://si0.twimg.com/profile_images/1482086847/LR_Blog_Button_Design_150x150_copy_normal.jpg,"Crafty creator, teacher and artist. Mixed Media, paper crafts, fabric/fiber crafts.",,http://t.co/BbFHqKqtNN,181,158,1260,2011-05-24 14:37:03+00:00,1
21354032,Carlin Doran ,carlinfella,https://twitter.com/carlinfella,https://si0.twimg.com/profile_images/1417808910/IMG_0271_normal.jpg,"Owner of Flatiron - Bespoke Hair for Men and women, Male Grooming guru and all round good chap with a twist of grumpiness",Dublin,,102,391,876,2009-02-19 23:49:06+00:00,1
20719005,Aengus Barton,lampsie,https://twitter.com/lampsie,https://abs.twimg.com/sticky/default_profile_images/default_profile_6_normal.png,Made from hoses,,http://t.co/h0Yd8jimlQ,7,6,5,2009-02-12 21:11:20+00:00,1
329326363,Ciarán,ApotheCiaran,https://twitter.com/ApotheCiaran,https://si0.twimg.com/profile_images/378800000319939442/10e03ad279b604672cffbd2111c4ab38_normal.jpeg,"I'm not creepy, I just have a really good memory.",The Land of Wind and Ghosts,http://t.co/NcunGB91ad,469,371,7364,2011-07-04 22:03:42+00:00,1
610994890,Alaani Clothing ,Alaani_Clothing,https://twitter.com/Alaani_Clothing,https://si0.twimg.com/profile_images/2488432409/ovisyj35rktyyrqo5mt3_normal.jpeg,Irish owned online clothing boutique  you can also follow me @vonfluffy,International,http://t.co/vSPCynxMe1,630,1641,138,2012-06-17 17:44:26+00:00,1
145789023,Pups,GlendaPups,https://twitter.com/GlendaPups,https://si0.twimg.com/profile_images/378800000346517794/058bb25ee6191a9a1c684fc51694021b_normal.jpeg,Mammy 1st - Consultant with Elizabeth Arden Dublin GAA nutball   Big eyes  Loves to laugh  ❤'s @magicotime Like to make words up  Ask me hulahoop ⭕ loveage,Dublin's fair city,http://t.co/0zvLmpyXH6,1241,749,34734,2010-05-19 22:00:09+00:00,1
16285288,Catalina Pandemonium,Miareeva,https://twitter.com/Miareeva,https://si0.twimg.com/profile_images/378800000189023494/afd0716d693e8068689501a3ac5f0728_normal.jpeg,Awkwardly blunt when caught off guard. My twittercrush can crush your twittercrush. Fierce to a nice degree.,,,775,1057,70137,2008-09-14 17:58:48+00:00,1
220633000,Jordan McDonnell,jordanmcd,https://twitter.com/jordanmcd,https://si0.twimg.com/profile_images/3747827813/0cb83acc755996d557689747e22b5916_normal.jpeg,"I'm like a tall slim buddha, working away @Twitter and having the lols with my #TwitterDublin tweeps! P.S. The zombie apocalypse is coming!","Dublin, Ireland",http://t.co/JEbOSmWEsb,1071,718,2109,2010-11-28 11:14:56+00:00,1
374610760,Ann Butler,AnnButlerDesign,https://twitter.com/AnnButlerDesign,https://si0.twimg.com/profile_images/2480850126/00bkdcmy3rwmer91nfbi_normal.jpeg,"Co-Owner/Director of Marketing @BellaCraftsQuarterly Magazine FREE online, Licensed Designer, Consultant, Artist & Instructor for the Creative Industries",Minnesota,http://t.co/Y2gupTA4WA,2923,2834,9693,2011-09-16 16:25:44+00:00,1
30024637,Tony O'Leary,IrishTonyO,https://twitter.com/IrishTonyO,https://si0.twimg.com/profile_images/1534700310/TonyO_normal.jpg,"Wexford man up in the big smoke, love my coffee and Daisy my dog and companion. Twitter addict, news and political junkie these days and always up for a laugh",Dublin,,1175,1114,19709,2009-04-09 17:22:17+00:00,1
18333423,Daniel Fahy,DanielFahy,https://twitter.com/DanielFahy,https://si0.twimg.com/profile_images/378800000462250482/5f553bc4eb81842068c2a786cffe595e_normal.png,"More often than not I talk about horror films, comics and video games. I tell people to stop being dorks on BSS.",Dublin,http://t.co/YPk5kiC3Q2,83,348,13101,2008-12-23 14:10:36+00:00,1
21309877,Anita Mernagh,anitamernagh,https://twitter.com/anitamernagh,https://si0.twimg.com/profile_images/378800000499755270/0545b2f0a03fd9ed75615cd34a98e8c9_normal.jpeg,"graphic designer - interested in After Effects, Motion Graphics, Projection Mapping, Music, Dance, Fashion, Photography, Street art, NY, Paris, inspiration...♥","Dublin, Ireland",,94,439,78,2009-02-19 15:53:43+00:00,1
20357199,Trish Byrne,TrishByrne,https://twitter.com/TrishByrne,https://si0.twimg.com/profile_images/2510990880/axft67ms5otbifwwg8zv_normal.jpeg,Writes things about other things.,,http://t.co/n6YgvkILn1,931,339,16042,2009-02-08 09:19:09+00:00,1
13884462,Sarah Ní Riain,froodie,https://twitter.com/froodie,https://si0.twimg.com/profile_images/378800000181509049/c73d99d89c033b0f87a2b816e4df3a13_normal.jpeg,"Bespectacled, not respectable. Marketing Co-ordinator for @CFCP. The Tracy Piggott of roller derby.","Dublin, Ireland",http://t.co/1oMigatdAP,903,524,14426,2008-02-24 00:36:03+00:00,1
304912237,Joanne Wadsworth,JoanneWadsworth,https://twitter.com/JoanneWadsworth,https://si0.twimg.com/profile_images/2696421978/fef92da1b29a9fecab58d3eab53d2361_normal.jpeg,"Writer of Romance, YA Fantasy, Contemporary & Historical Highlander with Lyrical Press NY. A Kiwi who loves the beach. After dreamy books? Come visit my website",New Zealand: ,http://t.co/hF9zh2EEsU,106587,91701,8914,2011-05-25 09:47:08+00:00,1
53226739,Randolph Pitts,RandolphPitts,https://twitter.com/RandolphPitts,https://si0.twimg.com/profile_images/378800000223681087/51bd40ebfb3fae8fa2cfdd990c23b8ea_normal.jpeg,"Ex-CEO, Lumière Films (LEAVING LAS VEGAS). Modern classical music, composing, philosophy, hiking. Principal, Randolph Pitts Productions (screenwriter/producer).","Studio City,CA&NY,NY",http://t.co/uo0Yp6mLcU,111,694,831,2009-07-02 23:38:00+00:00,1
120154441,Ged,TheLoneBadger,https://twitter.com/TheLoneBadger,https://si0.twimg.com/profile_images/378800000394395671/f7f3d59c81199e0cfcd1f54565de354f_normal.jpeg,"Former HMVer, ALDIte, builder supplier. Current husband and procrastinator.","Castle Greyskull, Drogheda",http://t.co/9EwxFHXm6B,319,716,15622,2010-03-05 16:39:21+00:00,1
299136109,Lili ,mskurlykelly,https://twitter.com/mskurlykelly,https://si0.twimg.com/profile_images/2162714794/DSC02782_normal.JPG,Exsisto praeclarus ut invicem.,"Dublin, Ireland",,298,414,3369,2011-05-15 15:29:51+00:00,1
120059414,gary dowling,bridgebitch,https://twitter.com/bridgebitch,https://si0.twimg.com/profile_images/2281760704/5720i9m9l71x4411063f_normal.jpeg,I finesse therefore I am,Wicklow,,92,219,4122,2010-03-05 10:30:23+00:00,1
342637480,DOGS,dogstheband,https://twitter.com/dogstheband,https://si0.twimg.com/profile_images/378800000181160296/1943b5bbcb29cea0d077bf58aa445ec9_normal.jpeg,"Electronica. Ireland. Computers. Guitars.

Bookings / contact: dogstheband [at] http://t.co/V8ZUAWyT16",Ireland,http://t.co/cMhmANV0pW,322,703,521,2011-07-26 10:23:41+00:00,1
21700356,Mike Mc Loughlin,zuroph,https://twitter.com/zuroph,https://si0.twimg.com/profile_images/378800000151888184/27c6358a3f06be0885d22d3723e3182b_normal.png,"Time magazine's person of the year 2006, Nobel Peace prize winner 2012",Ireland,http://t.co/yC1lj25I,735,1913,7799,2009-02-23 22:12:07+00:00,1
704043098,Local Ghosts,LocalGhosts,https://twitter.com/LocalGhosts,https://si0.twimg.com/profile_images/3385440421/cc64911ec7ac71819986adb382e6a0cc_normal.jpeg,Local Ghosts is an Arts and Culture Webzine,Brooklyn,http://t.co/KWqswuHs71,265,250,221,2012-07-19 00:18:14+00:00,1
20932822,Sarah Elliott,CranberryVulcan,https://twitter.com/CranberryVulcan,https://si0.twimg.com/profile_images/3121606925/8e397a99c9570f597591b257355c4839_normal.jpeg,"Artist. Vulcan. Sometimes writer. Organizer. Doodler of things.
https://t.co/IVeX1zehKz",Ireland,http://t.co/b6dRAs9cu8,502,1601,8391,2009-02-15 20:02:52+00:00,1
93150232,Cathal Keogh,cathalkeogh,https://twitter.com/cathalkeogh,https://si0.twimg.com/profile_images/3210155112/674b5187ad2acbaba00980429cb955b6_normal.jpeg,Fire Alarm Designer. A leading provider of Fire Alarms & Fire Extinguishers in Ireland. Over 20 years experience in Fire Safety.,"Kildare Town, Ireland",http://t.co/Ie2tPJg9ku,1705,1999,41966,2009-11-28 09:12:43+00:00,1
14315443,heather,hjames,https://twitter.com/hjames,https://si0.twimg.com/profile_images/1747769404/heather-2012_normal.jpg,"Learnin about stuff.
Work tweets: @learningdrupal",Belfast,,2009,782,10238,2008-04-06 13:49:03+00:00,1
120872587,Petra,Petra_Xia,https://twitter.com/Petra_Xia,https://si0.twimg.com/profile_images/1620468027/petrawhatstigna_normal.jpg,Getting back into this.... slowly...,,,234,344,17519,2010-03-07 20:55:55+00:00,1
213862367,Pádraig Howlin,phowlin,https://twitter.com/phowlin,https://si0.twimg.com/profile_images/1317335535/48908_819184417_6656_n_normal.jpg,Developer.  CoderDojo Mentor.  Part time MSc student.  Dad of 2.,Waterford,http://t.co/uNk3iX0Ugi,199,243,2139,2010-11-09 23:57:49+00:00,1
217073141,JulienBoutique.com,JulienBoutique,https://twitter.com/JulienBoutique,https://si0.twimg.com/profile_images/2242595297/julien_logo_normal.jpg,"Fashion Boutique
One Stop Shop for *GLAMOUR*",Dublin,http://t.co/27F3e1mHsZ,131,315,295,2010-11-18 14:21:52+00:00,1
322038356,BillionDollar-ID,BillionDollarID,https://twitter.com/BillionDollarID,https://si0.twimg.com/profile_images/1407946128/55_normal.jpg,"Carroll Foundation Trust $1,OOO,OOO,OOO, Criminal Case: Largest Ever White Collar Organized Crime Offshore Tax Evasion Fraud Heist In Modern Economic History.",Washington DC London,http://t.co/U6IyCGrqnw,317641,309555,7107,2011-06-22 14:58:35+00:00,1
138562111,Peter McGrath,mcgrathpeter,https://twitter.com/mcgrathpeter,https://si0.twimg.com/profile_images/1308095359/Hawk_Dan_normal.jpg,,"Dublin, Ireland",,114,908,188,2010-04-29 22:28:46+00:00,1
291935541,Ladyfuckwit,Ladyfuckwit,https://twitter.com/Ladyfuckwit,https://si0.twimg.com/profile_images/378800000324448939/6791a870063e735b875fe4acb78a014f_normal.jpeg,"Flirty, feisty, flighty, fun, free and flibbertigibbit are some of my favourite F words. Oh and I'm a massive contradiction with fabulous boobs.",,http://t.co/2l1fIGGEjm,13120,6909,77454,2011-05-02 21:09:55+00:00,1
76317082,Sarah Waldron,The_Licentiate,https://twitter.com/The_Licentiate,https://si0.twimg.com/profile_images/2867025356/271acef0dfad284e541496bd2376410f_normal.jpeg,"Fashion, feminism, books. Freelance writer, @IMAGE_Daily book ed, @corkindo fashion columnist, @fannydotie co-editor. A smartmouth, apparently. Opinions my own.",London,http://t.co/FcMGyDd1aP,870,348,6982,2009-09-22 12:15:17+00:00,1
416566428,ANNARCHY NYC,annarchy_blog,https://twitter.com/annarchy_blog,https://si0.twimg.com/profile_images/378800000472068112/01d5d7afb560b41975a1c89e6ddff034_normal.jpeg,#Art #StreetArt & #ArtBlog #NYC #RedHook #Brooklyn #EH: Studied #ArtHistory @ #Fordham University #ANNarchy #Art is the Proper task in Life: #LegalAidSociety,NYC,http://t.co/dQI0WvYuue,270,788,7179,2011-11-19 21:37:43+00:00,1
8394802,davkee,davkee,https://twitter.com/davkee,https://si0.twimg.com/profile_images/378800000351820658/a4042e6265da7e2b97c9ebdd11e90e10_normal.jpeg,,toronto,,141,1682,442,2007-08-24 00:57:14+00:00,1
16627130,Robert M. ,AspieJourno,https://twitter.com/AspieJourno,https://si0.twimg.com/profile_images/3747347910/fc9af773e63539ae9d5c9c6d15e67e11_normal.jpeg,Autistic journalist. #Raiders #Angels. Reader. Independent. #foodie #traveler #publictransit,Somewhere,,4663,5128,81633,2008-10-07 08:12:04+00:00,1
14053801,Blatherina,blatherina,https://twitter.com/blatherina,https://si0.twimg.com/profile_images/378800000360193333/7ec5a73846e3c112e0e3f88aaaa9bd95_normal.jpeg,"I like cafés, like a g6",Dublin,http://t.co/9IvSBhLNwC,882,1982,8898,2008-02-28 09:09:56+00:00,1
636786628,3XL so good,3XLSo,https://twitter.com/3XLSo,https://si0.twimg.com/profile_images/3035879249/bf8c21906f1b73bcb2827e353e7c4c65_normal.png,,,,42,378,143,2012-07-16 07:36:15+00:00,1
634253028,AfricaDirectTelecom,ADT_Africa,https://twitter.com/ADT_Africa,https://si0.twimg.com/profile_images/2392610473/zvfe21f1ep5a8gpc9m5s_normal.png,Africa Direct Telecom is based in Southern Africa providing low cost mobile services with the newest devices. Join the most reliable and cost effective network.,,,381,1257,6,2012-07-13 00:50:59+00:00,1
294073821,Jeffrey Roe,Jeffrey_Roe,https://twitter.com/Jeffrey_Roe,https://si0.twimg.com/profile_images/1361798995/resistor_ladder_69EB5991-C7DA-B2F9-A0C6BE36D0B108A3_normal.jpg,"Engineer, Hackerspace member and a maker of all sorts of contraptions.  Has a hand in running events eg  @Dublinmaker, @GaelHack","Dublin, Ireland",http://t.co/eGV5jUCWNA,479,644,1574,2011-05-06 13:50:12+00:00,1
519934904,Becky,becky_dmp,https://twitter.com/becky_dmp,https://si0.twimg.com/profile_images/3623038514/a1b414faa222b3b6fc35bc06266cac30_normal.jpeg,"Dance Movement Psychotherapist, Dementia Adviser & editor of @BMALonline. All tweets are made in a personal capacity. Especially the ones about Doctor Who.",Brighton,http://t.co/wil3bYAzhK,238,822,969,2012-03-10 00:00:56+00:00,1
