id,name,screen_name,profile_url,profile_image,description,location,url,followers_count,following_count,statuses_count,created_at,batch
43089762,David Conde,davidconde,https://twitter.com/davidconde,https://si0.twimg.com/profile_images/1302403702/Photo_on_2009-12-15_at_13.56__2_normal.jpg,Creator of Software and Beer,"Wexford, Ireland",http://t.co/yDZ1oVeZAc,607,862,4923,2009-05-28 11:14:09+00:00,1
97729914,Alan Hayes,jeditraining,https://twitter.com/jeditraining,https://si0.twimg.com/profile_images/378800000366161114/3e553a54e36601384b5e64441a696759_normal.jpeg,"alanhayes.ie Youth Worker,Teacher,Learner, Authentic Facilitator,Husband,Father,King of the Red Heads 2012 @IrishRedHeads",,http://t.co/XOvoG2UXBw,661,1134,7032,2009-12-18 19:15:44+00:00,1
271016995,jonas wal,JonasWal21,https://twitter.com/JonasWal21,https://si0.twimg.com/profile_images/378800000111435714/f80195d050925dd97a4ba563d6452de1_normal.jpeg,"Swim, fitness and Pilates instructor, acupuncturist, photographer, performer and all round over-extendor.",Dublin,,23,53,118,2011-03-23 18:02:27+00:00,1
39351386,Frank Schnittger,Frankschn,https://twitter.com/Frankschn,https://abs.twimg.com/sticky/default_profile_images/default_profile_4_normal.png,,,,8,13,9,2009-05-11 21:49:00+00:00,1
169583573,CuriousCupcakes,CCupcakes,https://twitter.com/CCupcakes,https://si0.twimg.com/profile_images/1139546173/40552_122720797776802_104489312933284_126774_212294_n_normal.jpg,,Dublin,http://t.co/Pi9hSaeznH,165,170,679,2010-07-22 17:55:22+00:00,1
108617017,KieranSaysThis,KieranSaysThis,https://twitter.com/KieranSaysThis,https://si0.twimg.com/profile_images/1365009578/image_normal.jpg,"Student, Rockabilly fan, News addict",Scotland,,286,323,2245,2010-01-26 14:21:14+00:00,1
95544039,Saidhbh O' Malley,Saidhbheen,https://twitter.com/Saidhbheen,https://si0.twimg.com/profile_images/1410475754/edit3_normal.JPG,"Rocky Horror, Model, Dancer, Archaeologist, Maths Teacher, Dyed hair, Pierced...F**KIN' AWESOME...","Dublin, Ireland",,49,63,269,2009-12-09 01:16:12+00:00,1
21089794,Niall Thomas,Niall_Of_Syn,https://twitter.com/Niall_Of_Syn,https://si0.twimg.com/profile_images/1305970015/Image0098_normal.jpg,,Roscommon The Land 'o' Green,http://t.co/C4ssiP8730,236,1485,1620,2009-02-17 13:52:49+00:00,1
251802764,JP D'Arcy,tippmanincork,https://twitter.com/tippmanincork,https://si0.twimg.com/profile_images/2979912841/70bb3845e426c12790ea37c509538688_normal.jpeg,"Apprentice motor mechanic. love life, my kids, wife ,dog , gaa and occasionally Guinness =-)",Cork Ireland,,47,106,455,2011-02-13 21:52:50+00:00,1
6145592,Just Clara,Clarabel,https://twitter.com/Clarabel,https://si0.twimg.com/profile_images/378800000228279646/1d3fd582fb92da0fce51a89d95c3420d_normal.jpeg,"Seldom on, intense when I am.",,,551,421,3623,2007-05-18 19:09:12+00:00,1
21560630,anaesthete,jrmhbky,https://twitter.com/jrmhbky,https://si0.twimg.com/profile_images/2995515660/e116699eab17ef398bd2f5c3b3d44db0_normal.jpeg,"twitter feed for the anaesthete music blog, interspersed with occasional meaningless observations and sarcastic quips.",from a distance,http://t.co/PBhzf7zNF0,182,586,4539,2009-02-22 11:48:52+00:00,1
20727403,Kelly Myers,KellyLou17,https://twitter.com/KellyLou17,https://si0.twimg.com/profile_images/3444753163/e42bbb3e67dc1466bd4cf7bd87ed38d5_normal.jpeg,We're all so intimately rearranged.,"Peterborough, England",,323,246,13382,2009-02-12 22:37:25+00:00,1
118120822,ASK Campaign,ASKcampaign,https://twitter.com/ASKcampaign,https://si0.twimg.com/profile_images/1094506418/ASK_logo_-_low_res_normal.jpg,ASK - Advocacy.Sexuality.Knowledge. is a not for profit youth group campaigning for full access to sexual and reproductive rights for young people in Ireland.,Ireland ,http://t.co/J64dsQojE5,126,231,479,2010-02-27 17:25:13+00:00,1
257411468,Alt. Miss Ireland,alternativemiss,https://twitter.com/alternativemiss,https://si0.twimg.com/profile_images/1904151266/ami-twitter-image_normal.png,"The ribald beauty pageant, Alternative Miss Ireland celebrates her 18th (and final) pageant on Sun 18 March 2012. Raising money for Irish HIV/AIDS organisations",Ireland,http://t.co/sPdGEz15xy,873,1014,399,2011-02-25 10:51:57+00:00,1
19705915,Laurence Mackin,LaurenceMackin,https://twitter.com/LaurenceMackin,https://si0.twimg.com/profile_images/2248614749/BeatnikMe_normal.jpg,Arts Editor with The Irish Times. All views come with a sea room,,http://t.co/mP5jWX5fnu,2665,1121,4667,2009-01-29 10:59:39+00:00,1
46339630,meg.ie,meg_ie,https://twitter.com/meg_ie,https://si0.twimg.com/profile_images/2339798321/nq2uf7qv24gvnfrjipgz_normal.jpeg,music / movies / culture / events,ireland,http://t.co/jRTnvDsnHk,1088,896,2145,2009-06-11 07:36:56+00:00,1
256942499,Perch ,Perch_Design,https://twitter.com/Perch_Design,https://si0.twimg.com/profile_images/1565057584/fACEBOOK_normal.jpg,"Perch is a young, vibrant, inventive design company.We're driven to problem solve, simplify & create beautiful designs to improve the quality of living.",Cork and Dublin - Ireland,http://t.co/8qWRQlitFV,410,850,1449,2011-02-24 11:35:59+00:00,1
29555359,Sonya D,HunterSony,https://twitter.com/HunterSony,https://si0.twimg.com/profile_images/3361536163/2b32e4846f56f6895fc6be29cf7c4aa1_normal.jpeg,Can always be sent home,Hong Kong,,362,500,7189,2009-04-07 21:49:42+00:00,1
209736673,Emer O'Neill,emer_oneill,https://twitter.com/emer_oneill,https://si0.twimg.com/profile_images/1155263385/emerpic_new_normal.jpg,"Female, redhead, dubliner, mom of 3, wife of 1. Interested in all things Digital Marketing related.","Dublin, Ireland",http://t.co/BfU2gRwQik,489,1151,1367,2010-10-29 20:29:28+00:00,1
144521897,ChristineDelany,ChrissyD37,https://twitter.com/ChrissyD37,https://si0.twimg.com/profile_images/378800000040812698/ab199157a3c00d9a7a9d411e597d1945_normal.jpeg,Struggled to be the 'mature' student in my Speech and Language Therapy class for four years. Now I'm just struggling to be mature.,"Dublin, Ireland",,50,187,362,2010-05-16 14:57:33+00:00,1
21806462,Miriam Dillon,MirsDillon,https://twitter.com/MirsDillon,https://abs.twimg.com/sticky/default_profile_images/default_profile_6_normal.png,,,,157,819,145,2009-02-24 22:28:32+00:00,1
258748744,Theodore Bear,bearofthebears,https://twitter.com/bearofthebears,https://si0.twimg.com/profile_images/2647906100/a2a0886462a4d8f87bf353bebacbae21_normal.jpeg,"ex-student of built environment, lover of retro games and red lemonade, hates all things architecture related",Dublin mostly,,48,188,186,2011-02-28 12:04:46+00:00,1
39470097,Eireads,eireads,https://twitter.com/eireads,https://si0.twimg.com/profile_images/1503452149/eireads_icon_normal.png,"Free classifieds Ireland, free Irish ads. Place classifieds in the 32 Irish counties. Powerful way to buy and sell automobiles, real estate pets, holidays deals",Ireland,http://t.co/ah6SZSSnac,632,1638,2773,2009-05-12 10:01:45+00:00,1
171169506,Securigen Monitored,securigen,https://twitter.com/securigen,https://si0.twimg.com/profile_images/1875288338/twitterprofilepic__3__normal.jpg,We are a security Monitoring company operating nationwide in Ireland. We are HQ in Dublin City. Wholly owned @useestatus,"Dublin, Ireland ",http://t.co/Que9QT6U6c,316,688,1124,2010-07-26 18:40:31+00:00,1
256601100,Vintage Basement,vintagebase2011,https://twitter.com/vintagebase2011,https://si0.twimg.com/profile_images/1252516277/Vintage_Basement_Website_Picture_normal.JPG,"We are a unique Vintage Clothing store located within the Brick Lane area of London.

We are pleased to announce the launch of our new Website.",London - UK,http://t.co/GuVS2Ystoo,729,1906,18,2011-02-23 17:43:12+00:00,1
21756920,John Marshall,johnnypixel,https://twitter.com/johnnypixel,https://si0.twimg.com/profile_images/378800000502916527/0d59b291ac7b2d8687f1a4a375947035_normal.jpeg,I haven't deleted my account in weeks!!,"Dublin, Ireland",,863,502,18715,2009-02-24 14:17:31+00:00,1
21643840,Kevin McPartlan,KevMcP,https://twitter.com/KevMcP,https://si0.twimg.com/profile_images/1869449681/001_normal.JPG,"PR guy, bon viveur, music fan and mild technophobe. I tweet for no one but myself.","Dublin, IE and elsewhere",,708,1103,4277,2009-02-23 10:21:53+00:00,1
236207228,AWOL Tattoos Galway,awoltattoos,https://twitter.com/awoltattoos,https://si0.twimg.com/profile_images/3094844553/a6911f31e567425450ade792c3b8cebd_normal.jpeg,A.W.O.L Tattoos & Piercing is a  family-run Tattoo and Piercing Studio  at 2 Newtownsmith (opp Sally Longs) 091 441942 awoltattoos@gmail.com,"GALWAY, Ireland.",http://t.co/Zrsw7oZ5,619,435,1459,2011-01-10 02:00:15+00:00,1
243799115,Andrew Davies,CampaignFilm,https://twitter.com/CampaignFilm,https://si0.twimg.com/profile_images/3548873402/d192e2dde5ffc9b920700b2b86556800_normal.png,Freelance filmmaker working with non-profits on campaigns and fundraising. Also do magic tricks.,London,http://t.co/EZQJPNzu3f,225,475,207,2011-01-27 20:58:17+00:00,1
197054794,Stephen Downes,StevieDownes,https://twitter.com/StevieDownes,https://si0.twimg.com/profile_images/2527903410/StevieDownes_normal.jpg,"Poet..Not a journalist, not a hack, not an economist. Just me. All views are my own...or are they?? #EFC ",Dublin,,1022,1430,9503,2010-09-30 15:03:16+00:00,1
20151181,Joe Vaughan,joe_vaughan,https://twitter.com/joe_vaughan,https://si0.twimg.com/profile_images/75683109/JoePhoto_normal.jpg,I am made of star-stuff and questions.,"Cambridge, UK",http://t.co/PgRJQNAUWE,429,1295,1470,2009-02-05 14:18:46+00:00,1
241066834,OMFJ Ireland,OMFJ_Ireland,https://twitter.com/OMFJ_Ireland,https://si0.twimg.com/profile_images/1249015431/omfjLogo_twitter_normal.png,"Irish comedy videos! 
Production division at http://t.co/Dwv9UhX9gh",Ireland,http://t.co/O8bEbCvO3v,140,857,303,2011-01-21 11:22:05+00:00,1
15101822,feylya,feylya,https://twitter.com/feylya,https://si0.twimg.com/profile_images/1185983174/igor_normal.jpg,"Narcissistic borderline alcoholic with delusions of adequacy. Also, does strange things on computers.",,,1134,1141,112930,2008-06-12 22:14:02+00:00,1
184831292,Jim O'Leary,artweblocal,https://twitter.com/artweblocal,https://si0.twimg.com/profile_images/1196430530/Jim_normal.jpg,Poet & Artist; Studio near Cork City  where I write & paint in Oils/Acrylics.,"Cork, Ireland",http://t.co/hIq31KWbRZ,158,549,30,2010-08-30 15:57:16+00:00,1
236149712,The National Sketch,NationalSketch,https://twitter.com/NationalSketch,https://si0.twimg.com/profile_images/1223975301/TNS-Logo2_normal.png,,Dublin,http://t.co/ocOwtKnAFB,145,788,154,2011-01-09 22:48:39+00:00,1
247903160,ahmed,vip_2011,https://twitter.com/vip_2011,https://abs.twimg.com/sticky/default_profile_images/default_profile_1_normal.png,,,,29,351,3,2011-02-05 20:36:03+00:00,1
20979242,John Morton,mohnjorton,https://twitter.com/mohnjorton,https://si0.twimg.com/profile_images/378800000376729572/b53f44ed5cae1cbc915618c9e3f72bc0_normal.jpeg,Actor. Writer. Maker of things. @Mycrofilms and @devioustheatre are where I do my making.,"Dublin/Kilkenny, Ireland",http://t.co/K1r6xEPsOc,781,557,5325,2009-02-16 11:52:49+00:00,1
228098695,Dr. Paddy Smyth,padsmyth,https://twitter.com/padsmyth,https://si0.twimg.com/profile_images/378800000494060990/6f09c44318e2b077715cda4b30513b6b_normal.jpeg,Medical Doctor. Interests include Healthcare Economics and Local Government Reform. Prospective FG candidate for 2014 DCC election (Rathgar/Rathmines),Dublin ,,121,476,221,2010-12-18 18:22:57+00:00,1
1015041,John Murphy,avandale,https://twitter.com/avandale,https://abs.twimg.com/sticky/default_profile_images/default_profile_6_normal.png,,,,111,1373,172,2007-03-12 14:51:36+00:00,1
18777297,Your flexible friend,Flexbrowne,https://twitter.com/Flexbrowne,https://si0.twimg.com/profile_images/378800000104651735/dffa480ef9a6b441ffaf90f62d06c35d_normal.png,"I vent here a lot. Life's too short to be silent. Arts, Politics, History, Sport, Bullshit spotter.",Ireland,http://t.co/pC198akHla,1343,773,34306,2009-01-08 20:17:15+00:00,1
125335906,IAAS,EAAS2010,https://twitter.com/EAAS2010,https://si0.twimg.com/profile_images/768091027/Flag-Pins-European-Union-USA_normal.jpg,"Forever Young? The Changing Images of America, EAAS conference, Dublin 26-29 March 2010",TCD & UCD,,0,1,2,2010-03-22 13:46:39+00:00,1
21385826,Kitty Catastrophe,redlemonader,https://twitter.com/redlemonader,https://si0.twimg.com/profile_images/2852498861/f44c6c0e86384dfe1a49b051dc20a6c9_normal.png,Constantly planning for the zombie apocalypse. Has a devastating weakness for bacon fries and Tanora.,Dublin,http://t.co/3sW6fKcE01,1410,708,12434,2009-02-20 09:31:37+00:00,1
187889318,Suzanne OLeary,sjkoleary,https://twitter.com/sjkoleary,https://si0.twimg.com/profile_images/1130297627/image_normal.jpg,"Interested in travel, celebrity gossip, business & politics.","Wexford, Ireland",,86,317,11,2010-09-07 12:23:47+00:00,1
40257452,Niamh Hayes,niamhvus,https://twitter.com/niamhvus,https://si0.twimg.com/profile_images/2342806591/kyfcbscabvn7lbvhtkx2_normal.jpeg,"Trying to do less, better. Usually go on about politics/running/garden/house/disability/lgbtq/food/random stuff.","Dublin, Ireland",,444,879,7996,2009-05-15 15:03:15+00:00,1
14211343,mollydot,mollydot,https://twitter.com/mollydot,https://si0.twimg.com/profile_images/101377383/nut_normal.JPG,Programmer. Crafter. Serial hobbyist.,Kilkenny,http://t.co/TqxDuuw9F1,798,323,50606,2008-03-24 22:45:55+00:00,1
20230392,John 'Trips' Gallen,TheTrips,https://twitter.com/TheTrips,https://si0.twimg.com/profile_images/659870302/Avatar_for_twitter_normal.jpg,"‘Tripping’ – adjective 1. light and quick, as a step or pace.  2.  proceeding with a light, easy movement or rhythm. So, do be Careful With That Axe, Eugene :)","Dublin, Ireland",http://t.co/F3rgBPy9Qd,799,1999,4088,2009-02-06 11:22:42+00:00,1
42591042,The Mire,TheMire_net,https://twitter.com/TheMire_net,https://si0.twimg.com/profile_images/2100725508/MireJournalLogo_normal.jpg,The news spoofed by Donal Conaty. Books: The Eighty-Five Billion Euro Man and Ireland in The Bailout Years.  Satirist. Journalist. Editor.,"Sligo, Ireland",http://t.co/Gt0uNSnlap,1989,783,12416,2009-05-26 08:51:12+00:00,1
151204160,Aine AWOL Piercing.,AineThePiercer,https://twitter.com/AineThePiercer,https://si0.twimg.com/profile_images/378800000401805860/0da6402711e37108fd1ac228a2fb5ceb_normal.jpeg,"Body Piercer and Tattoo Shop Manager (A.W.O.L Tattoos, 2 Newtownsmith, Galway. 091 441942). Wine drinker. Thinker. Lover not fighter. I speak fluent Shoe.",Dublin / Galway.,http://t.co/aghwS6riyt,353,279,5100,2010-06-02 21:35:08+00:00,1
245132119,Pegasus Bridge,PB_IRL,https://twitter.com/PB_IRL,https://si0.twimg.com/profile_images/1230310773/pb_normal.jpg,Hello! This is the Irish Street Team for @pegasusbridge :),Ireland,,176,469,98,2011-01-30 23:38:34+00:00,1
117891770,liam murray,murrayla1,https://twitter.com/murrayla1,https://si0.twimg.com/profile_images/378800000494134932/635df19668bef9f4a382f1196542d186_normal.jpeg,"Wexford.Dublin.World.Work in TV .Tweet a lot about my love of Music. Also Movies,Travel.TV.CraftBeer.
Food. News.Sport.THFC.LeinsterRugby.MyViews.","Dublin,Ireland",,425,1100,5201,2010-02-26 23:37:28+00:00,1
228844276,Twit Karma,twkarma,https://twitter.com/twkarma,https://abs.twimg.com/sticky/default_profile_images/default_profile_3_normal.png,,,,1,7,2,2010-12-20 20:52:42+00:00,1
6274902,Gabriel Beecham,GBeecham,https://twitter.com/GBeecham,https://si0.twimg.com/profile_images/1265541541/gb_normal.jpg,,"Dublin, Ireland",,214,560,1210,2007-05-24 00:21:23+00:00,1
21008866,George Hook,ghook,https://twitter.com/ghook,https://si0.twimg.com/profile_images/1100738691/Hookie_normal.jpg,Broadcaster,Dublin,http://t.co/Y3f3ta5BGF,80526,5097,10985,2009-02-16 18:08:49+00:00,1
21326286,Deryck,DeryckTormey,https://twitter.com/DeryckTormey,https://si0.twimg.com/profile_images/3685534448/34d76945bad9391b43ea358cdf63006c_normal.jpeg,"Marketing Exec by day, Photographer... well by day as well... and by night... I'm a Marketing Exec by night too... but not everynight...",Dublin,http://t.co/fwk3LjIaDK,341,527,6001,2009-02-19 18:46:45+00:00,1
128539383,Ted,Ted10000,https://twitter.com/Ted10000,https://si0.twimg.com/profile_images/1660367837/image_normal.jpg,Materialistic hippy and sex-pest. Mostly wise; occasionally incorrect.,London,,134,484,1387,2010-04-01 12:21:54+00:00,1
18718792,Sara O'Hagan,SOH12,https://twitter.com/SOH12,https://si0.twimg.com/profile_images/2953251922/60f535a4e80e0e6ff9110bb52164c307_normal.jpeg,Becoming slightly addicted to Twitter ... It's my new best friend! Keeps me sane from my lecturing day job!,Perth Scotland,http://t.co/3L7Gsjd5P8,757,1998,10204,2009-01-07 11:51:59+00:00,1
20603689,Nicola Timmins,Tikkin,https://twitter.com/Tikkin,https://si0.twimg.com/profile_images/1230693733/me-new-colour-small_normal.JPG,"Film lover, film reviewer (@avgfilmreviews), amateur photographer and social media manager. All views are my own and may not reflect those of my employer.","Dublin, Ireland",http://t.co/klZq6BPcDl,765,839,5913,2009-02-11 17:13:39+00:00,1
41799103,Chris Lyttle MLA,Chris_Lyttle,https://twitter.com/Chris_Lyttle,https://si0.twimg.com/profile_images/1082887097/CL3_normal.jpg,"Alliance MLA for East Belfast
http://t.co/uzYjt5GUx0
chris.lyttle@allianceparty.org",,,3929,2685,1159,2009-05-22 12:09:42+00:00,1
101083460,Kevin Donnellan,Kevind04,https://twitter.com/Kevind04,https://si0.twimg.com/profile_images/378800000439394654/3d378ee6a221e78abc7540aebf36f5de_normal.jpeg,@storyful,Dublin,,824,778,7858,2010-01-01 23:28:02+00:00,1
20971849,Roisin Ingle,roisiningle,https://twitter.com/roisiningle,https://si0.twimg.com/profile_images/1249107418/IMG_0479_normal.jpg,,,,12328,1941,5867,2009-02-16 08:56:11+00:00,1
20584133,Beans,Peaadina,https://twitter.com/Peaadina,https://si0.twimg.com/profile_images/3703920250/25afc08d75e3b116e55b4913e7456b25_normal.jpeg,"Mostly absent mindedly daydreaming. I enjoy stuff, but also Things. I do not understand sports. At All. Any of them.","Galway, Ireland ",http://t.co/JrIRt3odwb,155,951,1908,2009-02-11 11:37:54+00:00,1
14671775,Pádraig Belton,PadraigBelton,https://twitter.com/PadraigBelton,https://si0.twimg.com/profile_images/53815024/patrick-belton_normal.jpg,Thirtysomething freelance journalist thing. Buys loo roll on eBay.,"ÜT: 51.417857,-0.067083",http://t.co/jig459dAn5,727,2001,449,2008-05-06 10:33:39+00:00,1
237662585,Tori Hockensmith,Tori776,https://twitter.com/Tori776,https://si0.twimg.com/profile_images/1214469264/DSC_0361_normal.jpg,,Pennsylvania,,356,1525,622,2011-01-13 10:14:01+00:00,1
152025437, Mr Purple,yumcafe,https://twitter.com/yumcafe,https://si0.twimg.com/profile_images/1592526322/MOLECULE-R_logo-grey-print_normal.jpg,bringing molecular cooking to your kitchen,Kilkenny,,167,112,663,2010-06-04 21:57:38+00:00,1
232827715,Quotably Queer,quotablyqueer,https://twitter.com/quotablyqueer,https://si0.twimg.com/profile_images/1203935808/qq_logo_normal.jpg,Queer quotes,,http://t.co/ublhOS3qXJ,2076,2425,81,2011-01-01 12:35:00+00:00,1
78440155,Sarah Walsh,Say_ra,https://twitter.com/Say_ra,https://si0.twimg.com/profile_images/1353705817/mee_normal.jpg,*witty& charming  bio under construction*,Dublin,,98,135,1156,2009-09-29 22:53:09+00:00,1
23367638,Lorna Purcell,LornaPurcell,https://twitter.com/LornaPurcell,https://si0.twimg.com/profile_images/3037265278/61721bbfaa450fb2daa80044d0d825d8_normal.jpeg,Online Marketer. Wannabe Beat Boxer. Lover of all things Creative. Always turn the immersion off.,Ireland,,396,893,757,2009-03-08 23:03:27+00:00,1
20298292,Jim,JJ5000,https://twitter.com/JJ5000,https://si0.twimg.com/profile_images/3449101238/62d7488b74d971700b187a5be5077cdc_normal.jpeg,I hope you know that this will go down on your permanent record.,Baile Átha Cliath,http://t.co/Y6QLqTx01b,786,1998,24917,2009-02-07 07:26:28+00:00,1
30201840,Anne (Reid) Morris,FancyONancy,https://twitter.com/FancyONancy,https://si0.twimg.com/profile_images/2523877948/image_normal.jpg,,The Garden County,,357,1070,1712,2009-04-10 11:46:50+00:00,1
27559333,Katrina Darcy,Delilah_cat,https://twitter.com/Delilah_cat,https://si0.twimg.com/profile_images/378800000484056532/c87f27dc224afc1cf7cfe62c75015c01_normal.jpeg,Pink haired beauty blogger from Dublin. Lover of all things fluffy and fabulous.,Dublin,http://t.co/gAL0nhUDT7,654,697,44447,2009-03-30 02:00:28+00:00,1
226295119,Stephen Nölan,Stephen_if,https://twitter.com/Stephen_if,https://si0.twimg.com/profile_images/3342379311/019e66c0e82708a46a86c61317aeb911_normal.jpeg,Irish Artist and person in general,Ireland,http://t.co/tWdNB0fO9D,67,439,900,2010-12-13 20:33:32+00:00,1
158258917,Nekor ,nekorclothing,https://twitter.com/nekorclothing,https://si0.twimg.com/profile_images/1089854351/NekorType-Avatar_normal.jpg,I'm nobody important. Just a weathered soul trying to live through the scribbles and typography of my world. Application on to thread and steel.,"Los Angeles, Ca",http://t.co/1csvQmC0cY,1031,1597,2181,2010-06-22 05:43:04+00:00,1
219474513,Bella Bells Vintage,vintage_dress_,https://twitter.com/vintage_dress_,https://si0.twimg.com/profile_images/1174932069/bella-bells-logo_normal.gif,"Womens Vintage Fashion from the 1920's to the 1980's. Specialising in cocktail dresses, evening dresses and day dresses. Womens Vintage and Retro Clothing",,http://t.co/XUKBj0xpNm,2976,3513,525,2010-11-24 23:46:43+00:00,1
9549832,EM,_1E,https://twitter.com/_1E,https://si0.twimg.com/profile_images/378800000420173846/d5a51335de1c5baf10085aec644a81b3_normal.jpeg,"Advisory: stubborn, opinionated, argumentative, swears a lot!  Gamer, kayaker, *amateur* astro-photographer, #intactivist. Has a grá for the gaeilge.","54.25880, -8.57320",,563,727,30131,2007-10-19 20:23:06+00:00,1
40018637,Simon Moss,simonmoss_says,https://twitter.com/simonmoss_says,https://si0.twimg.com/profile_images/3568335997/a58f180f637b7b535ce38375505b5144_normal.jpeg,Creative designer and Burnley fan now working in St Albans http://t.co/8iGVF2tQM2,,,218,497,1855,2009-05-14 15:43:49+00:00,1
46078959,Colin Rodgers,OldManRodgers,https://twitter.com/OldManRodgers,https://si0.twimg.com/profile_images/1584987709/993F8C9944E94D4C836B4EFBF3AD58B8-500_normal.jpg,The letters http appear in FAR too many of my tweets. But they're usually funn..... Not Shit!,"Dublin, Ireland.",http://t.co/cXwTveK5SB,468,815,22073,2009-06-10 10:02:47+00:00,1
24297171,Donal Flynn,DonalFlynn,https://twitter.com/DonalFlynn,https://abs.twimg.com/sticky/default_profile_images/default_profile_3_normal.png,An extraordinary person with a very ordinary life.,"Co. Galway, Ireland",,242,774,336,2009-03-14 01:02:03+00:00,1
150776826,Alan Connolly,Alan_Connolly,https://twitter.com/Alan_Connolly,https://si0.twimg.com/profile_images/2713843823/b649c2b65d857c2274597c9f59404acc_normal.jpeg,"Married, Dad of 2. Self Employeed (@InsulationMen). Work for a living.....","Tower, Cork, Ireland  ",,314,420,6336,2010-06-01 20:05:52+00:00,1
125509760,Etsy Ireland Team,EtsyIreland,https://twitter.com/EtsyIreland,https://si0.twimg.com/profile_images/779603582/Etsy_Ireland_Button_normal.JPG,"We represent over 950 crafters, artists and designers based throughout Ireland. Come visit, we'd love to see you on the Blog. @ooakie tweeting on our behalf :D","Ireland, Europe",http://t.co/JNMXB0FPqk,1883,1602,2966,2010-03-23 01:21:57+00:00,1
21252287,Sinead McE,Sinead_McE,https://twitter.com/Sinead_McE,https://si0.twimg.com/profile_images/344513261573785336/2fedee6791e26173d169700cc0004f67_normal.jpeg,Exchanged a walk on part in the war for a lead role in a cage.,London/Dublin,,876,1146,20844,2009-02-18 22:58:34+00:00,1
24151144,colin j morris,ColinJM,https://twitter.com/ColinJM,https://si0.twimg.com/profile_images/378800000447431548/4cf5f67c65c867556e4ed1166af0b16e_normal.png,"Writes music for tv, film and self. Records anything that makes a sound, in Greystones studio. Mobile service available also.
Enjoys sandwiches and the odd tune",ireland,http://t.co/7eQlJYQgH2,1575,794,48848,2009-03-13 09:52:01+00:00,1
20293350,Gareth,garethoconnor,https://twitter.com/garethoconnor,https://si0.twimg.com/profile_images/3107875238/c9c81fe678c4a263b8a33a1f7dac3011_normal.jpeg,Managing Editor @TodayFMNews,Ireland ,,11804,9423,44759,2009-02-07 04:10:34+00:00,1
117678577,BigPinkHeart,BigPinkHearts,https://twitter.com/BigPinkHearts,https://si0.twimg.com/profile_images/1385885337/BPH_FunkyHeart_RGB_normal.jpg,Passionate about RESPECT http://t.co/vC0BMgwkOo will tell you more!,East Midlands,http://t.co/vC0BMgwkOo,1134,1454,4812,2010-02-26 07:51:49+00:00,1
84686215,FoxeinSocks,FoxeinSocks,https://twitter.com/FoxeinSocks,https://si0.twimg.com/profile_images/378800000311740164/6050681cb865d8c2e1d356bd60eb66dd_normal.jpeg,"G.Foxe. Technician, inventor, repairer of anything+everything, Father, husband, Irish emigrant. Likes odd photos+interesting things. Installer for Wolfhome NY",New York New York,,929,814,18352,2009-10-23 20:52:52+00:00,1
175120929,Bobby Cogan,bobbycogan,https://twitter.com/bobbycogan,https://si0.twimg.com/profile_images/1278381224/image_normal.jpg,"Je ne veux pas gagner des millions, j'ai de plus grandes ambitions - lFT",,,46,355,246,2010-08-05 17:59:49+00:00,1
23798252,JoBurger,JoburgerDublin,https://twitter.com/JoburgerDublin,https://si0.twimg.com/profile_images/1158845815/jo-burger_normal.png,"LEADER OF THE PACK [@crackBIRDdublin @skinflintDUBLIN @BEARdublin]
Tweets made by Joe & JBT: Group Res see website",RathminesD6 & CastleMarketD2,http://t.co/VQpLWBIJq8,9167,1181,5460,2009-03-11 17:49:27+00:00,1
226677663,Promote Fashion,promotefashion,https://twitter.com/promotefashion,https://si0.twimg.com/profile_images/1190650002/TwtSecrets_new_3_-_animated_normal.gif,I help bloggers and fashion brands to promote with twitter. You can auto search tweets for keywords (brand names) then auto follow. http://tiny.ly/PjH9,London,http://tiny.ly/PjH9,512,1853,25,2010-12-14 19:54:35+00:00,1
