id,name,screen_name,profile_url,profile_image,description,location,url,followers_count,following_count,statuses_count,created_at,batch
17868868,MargaretEWard,MargaretEWard,https://twitter.com/MargaretEWard,https://si0.twimg.com/profile_images/1359910112/56646e4a-278c-4b2d-bc6a-60ec56953e4c_normal.png,"CEO, Clear Ink & Broadly Speaking.
Loves to rock boats. Financial journalist, broadcaster (Newstalk, Irish Times, Sunday Times). NewYawka. WomenOnAir founder",Dublin Ireland,http://t.co/pRn3vnb05V,14145,7241,50202,2008-12-04 14:47:46+00:00,1
17005665,Cara,CaraLally,https://twitter.com/CaraLally,https://si0.twimg.com/profile_images/2726611327/a1c210ac0e01058e5c6b9c16f1a91518_normal.jpeg,"Like: art, music, film, theatre, travel, cooking, Ben & Jerry's, period drama, comedy, ghost stories. Dislike: ignorance, spots, being cold, being wrong",Roscommon,,687,639,19955,2008-10-27 19:55:22+00:00,1
388549595,James Cussen,JamesCsn,https://twitter.com/JamesCsn,https://si0.twimg.com/profile_images/378800000475971519/643a014702de77c67cc8f49de435a50f_normal.jpeg,IRCHSS Government of Ireland Scholar 2012-14 (UCC). I curate stupid; and study men in frocks who do bad things; 'Weirdo' -@mrs_bopp,"Cork, Ireland",http://t.co/g3tP0w67Ta,619,806,19980,2011-10-10 23:02:34+00:00,1
103141724,Jacky Wafflewaitress,Wafflewaitress,https://twitter.com/Wafflewaitress,https://si0.twimg.com/profile_images/378800000406480467/a77a51b35d23f854b58b92647a8e311d_normal.jpeg,"Head-meddler & film-buff. Breaking Bad, Sopranos and pesto addict. Available in 3d.",Sunny Eire.,,534,385,11727,2010-01-09 01:30:21+00:00,1
474199245,Marius,MariusPRA,https://twitter.com/MariusPRA,https://si0.twimg.com/profile_images/378800000439498498/b5e79a4cd6ea5e13d8a967c95d3458ca_normal.jpeg,"Here you will find my Ideas and attempts to become better at Marketing. YouTube Videos, graphic design, audio advertising. Judge my work http://t.co/TwrzBvxiLr",,,1014,1269,36,2012-01-25 19:09:27+00:00,1
1702461312,Malevolence,MalevolenceGame,https://twitter.com/MalevolenceGame,https://si0.twimg.com/profile_images/378800000365116850/d04d0505d7259584e154ea21d6dfdd7b_normal.jpeg,"Malevolence is a new choose your own adventure, interactive digital Gamebook/RPG for iPad and android with a completely original fantasy story","Dublin, Ireland",http://t.co/XVS9hqdxXX,125,567,12,2013-08-26 17:30:23+00:00,1
193773207,Diane,DianeD_,https://twitter.com/DianeD_,https://si0.twimg.com/profile_images/2708472674/065b0c56a572b4d81542865f09a3feb7_normal.jpeg,Politically unaffiliated | Barrister | General Practice with a specific interest in Child Law.,,,212,511,1451,2010-09-22 17:13:35+00:00,1
148977117,Jenny Kelly ,figgrolls,https://twitter.com/figgrolls,https://si0.twimg.com/profile_images/378800000469335095/1be15c7818d626cd385a7649f5adafc2_normal.jpeg,"Up there for thinkin', down there for dancin'...",Tipperary,,221,686,3551,2010-05-28 03:00:05+00:00,1
326869253,Samantha Kelly,Tweetinggoddess,https://twitter.com/Tweetinggoddess,https://si0.twimg.com/profile_images/3050646450/7d9d0c44122297ec26dc97b2e94f3fe2_normal.jpeg,"Mum of two Girls, , I love Dignity, Compassion, Courage.  #irishbizparty founder, Dragons Den survivor, #SBS winner. I will get you noticed!","Wexford, Eire",http://t.co/2s92lAzWPR,9286,6732,86228,2011-06-30 16:33:41+00:00,1
89998480,Paul Duggan,PaulDuggan_,https://twitter.com/PaulDuggan_,https://si0.twimg.com/profile_images/378800000478998329/826f16c64bb319688238036b406587f1_normal.jpeg,"Liberal, Fine Gael, Curmudgeon, Rogue, Rebel, Daddy. Creator and Author of Irish Shades of Grey.",Ireland,http://t.co/AdJESxsBvG,1818,862,34882,2009-11-14 19:02:47+00:00,1
22524380,Heath ilton,Sinewandbones,https://twitter.com/Sinewandbones,https://si0.twimg.com/profile_images/1258146423/blogimage_normal.jpg,I'm dead inside. Just like a zombie at a tea party.,Ireland,http://t.co/xniNAjyn17,107,48,2919,2009-03-02 19:36:25+00:00,1
72701241,Scott Balster,scottbalster,https://twitter.com/scottbalster,https://si0.twimg.com/profile_images/553821503/BalsterPodium2_normal.jpg,Experiments include @EmployTown (flip flopping the supply & demand for talent) & @Plane_Joy. Happy to help. Email: scott@employtown.com,"Loveland, CO",http://t.co/44Er4jnwYZ,13035,12126,25023,2009-09-08 23:26:32+00:00,1
293050366,Chloe Burke,chloedeburca,https://twitter.com/chloedeburca,https://si0.twimg.com/profile_images/3660208474/351effba1b297afe909f8296e0ec2c63_normal.jpeg,,,,156,620,98,2011-05-04 17:33:58+00:00,1
1329886650,Nicola Mitchell,mitchellnicola,https://twitter.com/mitchellnicola,https://si0.twimg.com/profile_images/378800000484525747/e5f591c6e51208ce1b59ffbe5ddebdf9_normal.jpeg,"Do you want my opinion or my approval? Socially liberal, occasionally hysterical, permanently feminist & eternally grateful.",,http://t.co/hwZmjkhCsQ,41,51,121,2013-04-05 19:15:56+00:00,1
312138819,Derek O Sullivan,Newberry52,https://twitter.com/Newberry52,https://si0.twimg.com/profile_images/3547067175/6087a92dd4dff0013a4adabb33293aed_normal.jpeg,"it's nice to be important, more important  to be nice.","Cork, Ireland",,430,1859,2715,2011-06-06 16:59:03+00:00,1
1693312039,Rachel Schoene,RachelSchoene,https://twitter.com/RachelSchoene,https://si0.twimg.com/profile_images/378800000344000162/96410ead96771766eafef6552ae74d5b_normal.jpeg,"Resident Fashion Contributor @DoneDeal, Professional Blogger, Commercial Writer, Mom, Niche Product Distributor, Business Woman.","Dublin, Ireland",http://t.co/BBVbgJMMBe,224,1109,237,2013-08-23 08:43:00+00:00,1
282096501,Thomas O'Brien,thomasbeta,https://twitter.com/thomasbeta,https://si0.twimg.com/profile_images/3431581338/1233327d6a268c465442c935b89c12ad_normal.jpeg,"Hominid thinking about neat ways to leverage peace, the Internet, & other exponential technologies.",Minnesota,http://t.co/1qgvMHwDlk,9267,8567,6681,2011-04-14 14:55:27+00:00,1
17271664,Johnny Ryan,johnnyryan,https://twitter.com/johnnyryan,https://si0.twimg.com/profile_images/1249574983/500x5001_normal.jpg,@IrishTimes Chief Innovation Officer; Author of 'A History of the Internet and the Digital Future' http://t.co/4WvJmmyV45,Dublin,http://t.co/WcSnPnaR21,4996,3893,4062,2008-11-09 18:03:05+00:00,1
54540814,Shaz,SharonWithAD,https://twitter.com/SharonWithAD,https://si0.twimg.com/profile_images/378800000185797324/d899aecde45568568ed4a9aae2cbf352_normal.jpeg,"Its 'Sharon, with a 'd' ' I don't have A.D.D. All tweets are my own, cos I'm a grown up",Dublin,,282,198,7853,2009-07-07 13:11:50+00:00,1
1158371,Marie Boran,pixievondust,https://twitter.com/pixievondust,https://si0.twimg.com/profile_images/378800000334607519/47898f15e55fc877fa05dcebb16ba61e_normal.jpeg,"PhD candidate @DERI. Interested in social media, scholarly publishing & #altmetrics. Also freelance sci/tech journalist (@IrishTimes).","Galway, Ireland",http://t.co/ayidBBXbho,6361,2506,28032,2007-03-14 14:12:17+00:00,1
307804805,Anne-Marie,am_flynn,https://twitter.com/am_flynn,https://si0.twimg.com/profile_images/378800000476287959/324c6c11d50b8b447dfb48ee8cfd05f7_normal.jpeg,Trying to figure it all out...secretly hoping I never succeed. Trying to make a difference by day. Dreamer by night. Occasional writer. GAA nut all the time,"From Mayo, on loan to Dublin",http://t.co/X3g3B2Qxc4,3358,2587,9803,2011-05-30 09:47:42+00:00,1
11214,Paul Watson,paulmwatson,https://twitter.com/paulmwatson,https://si0.twimg.com/profile_images/378800000497010013/85974646fe794ae775e5f4c596787949_normal.jpeg,"CTO @Storyful. South African father of @leahewatson & @ericdougwatson, partner to @fionahaughney, living in @Ireland.","Dublin, Ireland",http://t.co/TzJQcqXz7y,3012,944,95271,2006-10-31 21:05:36+00:00,1
10381512,Leon Quinn,reverbstudios,https://twitter.com/reverbstudios,https://si0.twimg.com/profile_images/3082961360/688ae45524de497b7b4b9bfeec45baf7_normal.jpeg,"Self-made Web & Digital Designer, Photoshopper, Wordpress 'Expert', Mouthy Blogger & Social Networker, Songwriter, Musician & Music Lover. And that's just today","Leitrim, North West Ireland",http://t.co/kHhorib0vH,1323,307,26655,2007-11-19 12:53:45+00:00,1
243356205,Rudy Hellzapoppin',RudyHellzapop,https://twitter.com/RudyHellzapop,https://si0.twimg.com/profile_images/3746502473/a9276f1df62178a621b0b5291f4a5f54_normal.jpeg,I usen't be anonymous. But I am now. Twitterati know exactly who I am.,"Dublin, Ireland",,743,1107,32756,2011-01-26 21:35:30+00:00,1
818306743,Daragh McGrath,mcgrathdar,https://twitter.com/mcgrathdar,https://si0.twimg.com/profile_images/2610426352/sidudl3eex1fswkguba8_normal.jpeg,UX Designer and Video Game Artist,"Dublin, Ireland",,64,169,157,2012-09-11 22:18:34+00:00,1
516913893,Shane Kavanagh,DogWokGames,https://twitter.com/DogWokGames,https://si0.twimg.com/profile_images/3598977741/b342216729a2958e947c53a27039529b_normal.png,Making games.,Dublin,http://t.co/F1QV0eWLEV,983,1979,198,2012-03-06 21:34:49+00:00,1
17686032,Roz ,RozD,https://twitter.com/RozD,https://si0.twimg.com/profile_images/378800000192052037/9046ead5d5d6beb7a1c379fb4e2ef4c1_normal.jpeg,"I sometimes say clever things and tweet poems. I sometimes swear and tweet about trash tv, I read sometimes I write sometimes - its a mixed bag!",,http://t.co/DxoSlqEOSW,1030,1324,44501,2008-11-27 19:20:22+00:00,1
45594041,Qwartz Music,QwartzMusic,https://twitter.com/QwartzMusic,https://si0.twimg.com/profile_images/378800000142147314/0cef0f2eae19d1b43eb2f82a88efaaab_normal.jpeg,"A participative e-commerce recommendations media beta-website, a new way to discover electronic and new music.","Paris, France",http://t.co/cSO9QURqLF,2209,2383,260,2009-06-08 15:48:00+00:00,1
27238835,Sylvia Leatham,SylviaLeatham,https://twitter.com/SylviaLeatham,https://si0.twimg.com/profile_images/1159520335/Sylvia_jpg_normal.jpg,STEPS Coordinator at @EngineerIreland. Engineers Week organiser. Co-founder of science podcast @Scibernia. Pun-loving criminal. (Tweets my own.),Dublin ,http://t.co/Pe5MISqRJS,1196,1267,4009,2009-03-28 14:43:44+00:00,1
1705580774,Blend,BlendTheApp,https://twitter.com/BlendTheApp,https://si0.twimg.com/profile_images/378800000478086562/f2a83e887449e06f0805f765a3f409f8_normal.jpeg,Blend is an interactive iPad app for creating your own homemade spice blends. It's being developed by @lizmaybury and @eoindoyle2 as part of our MSc at DIT.,DIT Aungier Street,http://t.co/T7021gYwHn,30,70,22,2013-08-27 20:43:11+00:00,1
631865140,tapastreet,tapastreet,https://twitter.com/tapastreet,https://si0.twimg.com/profile_images/378800000207500129/14166e6a7f3caaaa3424a3709305857a_normal.png,"See what's happening anywhere in the world through the eyes of those who are there. Available now on iPhone, iPad and Android",Dublin,http://t.co/Ski66YiE4K,118,431,118,2012-07-10 10:12:57+00:00,1
335839421,Christopher Scott,csgraphi,https://twitter.com/csgraphi,https://si0.twimg.com/profile_images/2795545484/52cb555e4dbf648e465a9a3a6ac3e03e_normal.png,Christopher Scott is an award winning internationally recognised poster designer.  Currently he is a professor at UMET del Ecuador.,"Quito, Ecuador",http://t.co/IEfq6TzjkF,179,447,727,2011-07-15 09:51:19+00:00,1
323287075,Yellowstone.ie,Yellowstone_ie,https://twitter.com/Yellowstone_ie,https://si0.twimg.com/profile_images/1810393648/qr_code-1_normal.jpg,"#Design & print management specialists: #DAM to The #Gathering; located in #Dublin, #Ireland

DigiVault is where we keep the #digital","Dublin, Ireland",http://t.co/rYNdnqmQCs,785,156,472,2011-06-24 15:37:16+00:00,1
16627544,Ciaran Cuffe,CiaranCuffe,https://twitter.com/CiaranCuffe,https://si0.twimg.com/profile_images/3592833139/1140e840be106a31491a7a7aa8659163_normal.jpeg,architect planner educator,,http://t.co/83WRmtv3US,5302,3006,2533,2008-10-07 09:29:06+00:00,1
1695992394,Honourbound,TheHonourbound,https://twitter.com/TheHonourbound,https://si0.twimg.com/profile_images/378800000350133597/e358f116f6dcb091a1da1c07f2b7a870_normal.png,"Honourbound is a 2D, side-scrolling beat ‘em game focused on dynamic and visceral God of War-style combat in a feudal Japanese setting",,,67,200,8,2013-08-24 09:27:51+00:00,1
359869318,Media HQ,mediahqnews,https://twitter.com/mediahqnews,https://si0.twimg.com/profile_images/2352427667/3u2qk5h8r8h5z9aaqbmi_normal.jpeg,Updated by Jack Murray (JM) Micheál Clesham (MC) Yvette Poufong (YF) Kate Cunningham (KC) Alex Sheehan (AS),"Harold's Cross, Dublin",http://t.co/kjOnD1UUgY,1551,1055,12350,2011-08-22 09:21:43+00:00,1
455798721,mike gargett,MikeGargett,https://twitter.com/MikeGargett,https://si0.twimg.com/profile_images/3282211226/135617f6d7ba7a92cc7bb853aebab6e9_normal.jpeg,"i have an interest in all things-every person is equal no matter where from-love nature,people and animals too",stockton,,9949,10870,93992,2012-01-05 14:41:52+00:00,1
29441194,Una Power,joeystrider,https://twitter.com/joeystrider,https://si0.twimg.com/profile_images/378800000428759442/c758348a48c1038675ed08dd6b88d502_normal.jpeg,"Shivering around UCD most of the time. Studying Politics, German & Portuguese.Seeking sunshine and news.",Dungarvan/Dublin,http://t.co/wz7DQrSeOt,437,470,5210,2009-04-07 12:55:52+00:00,1
31096135,MK,nairamk,https://twitter.com/nairamk,https://si0.twimg.com/profile_images/2884561994/6fcdcd4fd326996d843edd5f004cb5f2_normal.jpeg,"Irish Munster-ite, lover of cars, rugby, movie films & tattoos, Cinema Manager / Projectionist. Evil side of @MarianKelly","Roscommon / Athlone, Ireland",,35506,24618,34141,2009-04-14 10:37:02+00:00,1
15949407,Daragh Ward,daraghward,https://twitter.com/daraghward,https://si0.twimg.com/profile_images/2572428866/fokgzf5f23pa2kk0n98t_normal.jpeg,"CTO at Axonista, maker of Ediflo and other software delights for TV broadcasters.

Dreamer, adventurer, part-time sorcerer.",Dublin,http://t.co/y8REF3MqN0,620,587,2851,2008-08-22 19:56:29+00:00,1
20978407,Claire McHugh,clairemchugh,https://twitter.com/clairemchugh,https://si0.twimg.com/profile_images/2412426384/g3zu8x9mcv0m5rthm25z_normal.jpeg,"CEO at Axonista. Into TV, mobile, social,  habits, moods and trends. Participant. Doer. Likes measuring things. Went to Rock School. Talks a lot about TV.",Dublin,http://t.co/KNpdPPH7Qu,824,614,4492,2009-02-16 11:35:18+00:00,1
220636478,Michael Munevar,michaelmunevar,https://twitter.com/michaelmunevar,https://si0.twimg.com/profile_images/2149594614/Michael_Munevar_Painting_200x200_normal.JPG,"I work in #eCommerce operations. I tweet about #technology, #MBA  #education, #worldnews and things happening in #Dublin. Tweet me! #Networking","Dublin, Ireland",http://t.co/fA9X55EO1G,443,1226,495,2010-11-28 11:33:26+00:00,1
24431006,Rebeca  Huerga,Rebitt,https://twitter.com/Rebitt,https://si0.twimg.com/profile_images/3440014398/8b2b6eeee381c2aeddf2a641b0502c04_normal.jpeg,"200 v girl in constant β fase // Social Media, Marketing & Web Analytics // Managing Fashion brands //  Blogger in @soyceodemiblog and @apiscookies.",Barcelona - Ibiza,http://t.co/Of44AM5J20,1930,1773,5119,2009-03-14 21:14:42+00:00,1
364124842,Paul S. O`Brien,paulsobrien,https://twitter.com/paulsobrien,https://si0.twimg.com/profile_images/2692311326/8e3afa129749972ed869333de2014ec9_normal.png,"Artist & Developer based in Dublin, student of GameDev.","Dublin, Ireland",http://t.co/s30roSYopu,108,330,155,2011-08-29 07:17:53+00:00,1
14383171,supergingerdave,supergingerdave,https://twitter.com/supergingerdave,https://si0.twimg.com/profile_images/1308717983/supergingerdave_normal.jpg,"Agile geek, UX nerd. Studying an MSc in Product Management. 15yrs in telecoms, recently moved to digital finance.","Dublin, Ireland",,239,616,1833,2008-04-14 09:31:13+00:00,1
132142047,Smudged Cat Games,SmudgedCat,https://twitter.com/SmudgedCat,https://si0.twimg.com/profile_images/819506256/smudged_logo_twitter_normal.png,We made Shuggy and Gateways! This is the voice of David Johnston.,UK,http://t.co/tMWYS8yS2N,1249,535,2475,2010-04-12 11:46:28+00:00,1
54228043,Dave McCabe,davetheallthing,https://twitter.com/davetheallthing,https://si0.twimg.com/profile_images/2136655881/Davatar-square-transparent_normal.png,"Writer of films, novels, lectures, video games, comics, RPGs, haiku and drunken tweets.","Dublin, Ireland",http://t.co/5RJ0yWUVEy,328,233,4134,2009-07-06 15:04:49+00:00,1
373994636,Lewis Harvey,LewHarvey,https://twitter.com/LewHarvey,https://si0.twimg.com/profile_images/1544041598/253615_10150222860743447_510308446_7157068_4151478_n__2__normal.jpg,Associate Producer at Lionhead Studios,UK,,53,85,82,2011-09-15 14:39:51+00:00,1
117878909,Brian Hayes,obhaze,https://twitter.com/obhaze,https://si0.twimg.com/profile_images/1724212449/BiUmCQEC_normal,Irish/Canadian europhile holed up in London.  Confused. Slightly.,,,116,349,435,2010-02-26 22:43:08+00:00,1
270499105,James Beaton,jjb362,https://twitter.com/jjb362,https://si0.twimg.com/profile_images/378800000389013473/6826be972c8787805830c7ad4a71a51a_normal.jpeg,Librarian in Glasgow. Work at the National Piping Centre. Play the bagpipes. Occasionally tweet in Gaelic. Highland tendencies.,Glasgow,,495,1150,2842,2011-03-22 18:44:23+00:00,1
523106223,Hercules Georgiadis,sevenFishers,https://twitter.com/sevenFishers,https://si0.twimg.com/profile_images/3384139355/85ba9ae6d5d5f96f4da1878a743eac52_normal.jpeg,"Design & Brand Strategist - Creative & Curious - Craftsman & Doer
Greece",,,5540,5487,6919,2012-03-13 10:27:44+00:00,1
291111033,Arcade Con,ArcadeCon,https://twitter.com/ArcadeCon,https://si0.twimg.com/profile_images/3472493702/709ba9bc69f81a93275ad784bee31434_normal.png,Ireland's biggest and best geek convention! July 5th - 7th 2013 in Ballsbridge Hotel,Dublin,http://t.co/5zMgCk5ttj,587,855,916,2011-05-01 13:38:56+00:00,1
95127457,Mark Wheeler,Singaporemark,https://twitter.com/Singaporemark,https://si0.twimg.com/profile_images/1631502319/Shiedanme_normal.jpg,"Frustrated Chef and Fulham supporter working in a school here in Singapore. Been here over 25 years. Love reading, cooking and drinking wine and beer.",Singapore,,133,602,2343,2009-12-07 03:30:42+00:00,1
412955877,Caitriona Dwyer,CaitrionaDwyer,https://twitter.com/CaitrionaDwyer,https://si0.twimg.com/profile_images/1655104609/caitriona_2011_square_normal.jpg,laconic web developer. http://t.co/7ggUI97u2v «-- photoblog,"Dublin, Ireland",,178,231,668,2011-11-15 09:56:10+00:00,1
19392516,David O'Callaghan,davidoca,https://twitter.com/davidoca,https://si0.twimg.com/profile_images/72708919/me2007_normal.jpg,Daddy is my main job (this week). Ex Research Fellow in TCD Astrophysics and Computer Arch. & Grid research groups.,"Dublin, Ireland",http://t.co/YmeLfxkvxw,462,1512,1134,2009-01-23 12:45:15+00:00,1
1616561288,Privacy Ireland,privacyireland,https://twitter.com/privacyireland,https://si0.twimg.com/profile_images/378800000180613298/9a7ed7de3767052cf13d3be37d58c38b_normal.png,"1. Everyone has the right to respect for his private and family life, his home and his correspondence. — Article 8, European Convention of Human Rights",Ireland,http://t.co/NLVHcLpe7V,74,434,24,2013-07-24 01:57:39+00:00,1
459420906,Dubstarts,dubstarts,https://twitter.com/dubstarts,https://si0.twimg.com/profile_images/2209391688/logotwitter_normal.jpg,"A jobs fair for technology startups in Ireland. 3,000 talented job seekers to meet 50 fast growing companies on October 29th at Café en Seine.","Dublin, Ireland ",http://t.co/rp9LBIMvUx,1577,2001,353,2012-01-09 17:04:04+00:00,1
1615620720,MunchingMollies,MunchingMollies,https://twitter.com/MunchingMollies,https://si0.twimg.com/profile_images/378800000176602906/2fa3b3cdb018f6facaa960c14c2b2e7c_normal.jpeg,Thanks to all who made 23/8/13 #MunchingMollies such a success. (tweets by @WaffleWaitress). Next lazy lunch is already being planned,,,186,284,725,2013-07-23 16:39:41+00:00,1
21854341,Curry&Cake ,yvonneK07,https://twitter.com/yvonneK07,https://si0.twimg.com/profile_images/378800000254111797/45d8c32cee74e4db66b37470948291df_normal.jpeg,"Wife and mammy. Love cooking, baking and family time.",Ireland,,841,1950,19024,2009-02-25 10:50:31+00:00,1
36331389,Little Apples,magnificath,https://twitter.com/magnificath,https://abs.twimg.com/sticky/default_profile_images/default_profile_3_normal.png,,,,3,13,10,2009-04-29 10:48:39+00:00,1
1622977795,The WebSite Shop,WebSiteShopIE,https://twitter.com/WebSiteShopIE,https://si0.twimg.com/profile_images/378800000438852779/c18bfe46d3d7142f07b4966622d14d03_normal.jpeg,"A real physical shop for websites! 66 George's Street Upper, Dun Laoghaire.  Free workshops & hot desks.",Dun Laoghaire,http://t.co/j8F7jyKKS5,191,297,208,2013-07-26 13:26:41+00:00,1
6293572,Iain Gill,iaingill,https://twitter.com/iaingill,https://si0.twimg.com/profile_images/378800000501834540/ec37caf75232a1ba920d03277f9a0342_normal.jpeg,Westminster. Party Political Assistance  Middle East/Africa / Eastern Europe. CRLiberal. Dublin-er. Twiter newbie. LGBT.Swimmer,London UK,http://t.co/a6Nglypvnw,133,307,252,2007-05-24 18:31:06+00:00,1
550976646,Fintan O'Toolbox,FintanOToolbox,https://twitter.com/FintanOToolbox,https://si0.twimg.com/profile_images/3525727143/9f65b1e34a3a659c8f3c5ff66409cb3a_normal.jpeg,"Marcionite. Probable messiah. Politics and Religious Affairs correspondent for @DonegalDollop, Donegal's second best unfounded conjecture website.",Donegal,http://t.co/Kc8UFQEbGt,1400,430,23019,2012-04-11 11:00:19+00:00,1
227710771,michael logan,theleggalamb,https://twitter.com/theleggalamb,https://si0.twimg.com/profile_images/1693608671/rh4m6v71_normal,"Wine, food, books, art, music, these are a few of my favourite things","Cork, IRELAND",,879,1049,8425,2010-12-17 15:56:25+00:00,1
903597037,barrett,geronimoholmes,https://twitter.com/geronimoholmes,https://si0.twimg.com/profile_images/378800000184658803/4d0e6f4abc8e0c25aec93853e342066a_normal.gif,"My life is nothing without books, music, series and comics. I'm big fan of rock bands. I love The Song of Ice and Fire more than anything.",Westeros,,14825,8695,1879,2012-10-25 09:55:11+00:00,1
1558705675,CV Help Ireland,cvhelpireland,https://twitter.com/cvhelpireland,https://si0.twimg.com/profile_images/378800000074443484/6c71108ae404cc074fdd9dd2ad4368db_normal.png,"Experienced Irish Recruitment consulting team. We are here to help you get Employed. We specialise in CV's, Cover Letters & LinkedIn profile development",Ireland,http://t.co/5tSR6n4O5P,255,1319,111,2013-06-30 18:49:19+00:00,1
1613780719,maternityire,maternityire,https://twitter.com/maternityire,https://si0.twimg.com/profile_images/378800000172780416/39f6fd15e4cc63beb86e809992c33071_normal.jpeg,Since #Savita we've been told that Irish women receive the world's best maternity care; but do we really? Inspired by an article by @carolmhunt #maternityire,http://bit.ly/161L0oD,http://t.co/JQH7XGaYMy,855,872,1284,2013-07-22 22:07:21+00:00,1
53963470,CrayonConstantinople,Crayon_Constant,https://twitter.com/Crayon_Constant,https://si0.twimg.com/profile_images/3648760648/e00384d59221b5099d9f683193807ef2_normal.jpeg,,,,33,83,235,2009-07-05 18:01:39+00:00,1
126028926,Alan Hynes,hynesalan,https://twitter.com/hynesalan,https://si0.twimg.com/profile_images/3747600513/b05261af8a16d5164f08990883ef55f5_normal.jpeg,"Interested in Philosophy, Public Speaking, History, & Politics. Works as a Parliamentary Assistant.","Tuam, Galway, Ireland",,463,1329,1545,2010-03-24 16:23:46+00:00,1
1558479774,100minds,100_minds,https://twitter.com/100_minds,https://si0.twimg.com/profile_images/378800000068890213/65659e3f195d5abcb44f1d6ed9233995_normal.png,"100 Irish undergrads collectively raising €100,000 for @Temple_Street Large scale impact on a whole new level. #Simple #Transparent #LongTerm #100minds",Ireland,http://t.co/5CEDLEevoZ,390,1983,62,2013-06-30 17:12:30+00:00,1
118166260,Patrick Clowry,patrickclowry,https://twitter.com/patrickclowry,https://si0.twimg.com/profile_images/378800000449539999/c83374c6605b94a7173a151c449345d9_normal.jpeg,"Promoter of enterprise in Ireland.Background in ,Advertising, Publishing,Hospitality industry- Backpacker  Worldwide- Politics, sport  plus + alot.","Kildare - Dublin, ",http://t.co/ZDk3v3oG4R,1444,1604,7551,2010-02-27 20:20:21+00:00,1
220771828,TalentCoop Norah B,TalentCoop,https://twitter.com/TalentCoop,https://si0.twimg.com/profile_images/1710524069/4075bac4-c7fe-42b2-8736-f971cd4783c7_normal.png,"Fairy Godmother works with start up & growing biz. 
Co Founder #depressionhurts @121depression 
http://t.co/27NKTq40",Here and there.,http://t.co/H1Ee4y0uQS,1996,1623,80661,2010-11-28 19:53:57+00:00,1
17836764,ibelle,ibelle,https://twitter.com/ibelle,https://si0.twimg.com/profile_images/378800000063439502/83b226b23f5be34d620aeab408197cd9_normal.jpeg,twitter voyeur and occasional tweeter..a sociable loner.,dublin,,293,862,2578,2008-12-03 14:03:27+00:00,1
112760512,emohelelwhy,moatham,https://twitter.com/moatham,https://si0.twimg.com/profile_images/378800000350480092/fc5467a024f7ab16e953221db075a453_normal.jpeg,"I am little, I like boobs & books","ÜT: 51.680885,-0.003543",,260,747,6153,2010-02-09 16:32:12+00:00,1
1578487110,Social Life Dublin,SocialLifeD,https://twitter.com/SocialLifeD,https://si0.twimg.com/profile_images/378800000111309534/7f1ebde343eb515db3e39035f1e1186f_normal.jpeg,"Bringing Positive People together to socialize and part take in Hobbies, including Travel, Personal Development, Arts and Nights out! PM Jerry O'Brien","Dublin, Ireland ",http://t.co/vPhIsE6o9R,297,1131,92,2013-07-08 20:04:36+00:00,1
45557616,Lucy Keaveney,Luighseach,https://twitter.com/Luighseach,https://si0.twimg.com/profile_images/3604580398/46b9df07f3cd0f7ed77f77e00bb71525_normal.png,"Interested in equality in Politics, Media & Society. Countess Markievicz school: http://t.co/qhdT2hX5.
Gender imbalance in media:http://t.co/lWVbdi5O",Meath,,650,940,4506,2009-06-08 12:50:43+00:00,1
