id,name,screen_name,profile_url,profile_image,description,location,url,followers_count,following_count,statuses_count,created_at,batch
14395202,Christine Bohan,ChristineBohan,https://twitter.com/ChristineBohan,https://si0.twimg.com/profile_images/378800000435691141/f5e7102f6f530ad7755e77965b299dec_normal.jpeg,"Journalist, webhead, feminist, Dubliner. Deputy editor of @thejournal_ie, lecturer at DCU and former Guardianista. Views my own.",Dublin,http://t.co/xwBSq1OpEr,8162,3020,42500,2008-04-15 10:39:49+00:00,1
255481351,Volta,Volta,https://twitter.com/Volta,https://si0.twimg.com/profile_images/1929797802/Volta_Screen_Version_normal.jpg,"Stream or download Irish & International indie films on http://t.co/RoXA4Qi5. No monthly charges, just pay as you watch. Visit today & start watching instantly!",Ireland,http://t.co/PzR6sgF7tn,1327,1422,1383,2011-02-21 13:12:34+00:00,1
447231909,Amy Lowe,amyLowe80,https://twitter.com/amyLowe80,https://si0.twimg.com/profile_images/1827446798/Snapshot_20120206_6_normal.JPG,"Dog lover, good food and wine, great friends",Dublin,,82,263,452,2011-12-26 17:13:47+00:00,1
329876613,Claire Brophy,ClaireBrophy,https://twitter.com/ClaireBrophy,https://si0.twimg.com/profile_images/1427909002/263987_10150292661102288_612852287_9044058_7730942_n_normal.jpg,"PhD student/ feminist/ music obsessed bibliophile.  I co-ordinate a book festival sometimes, and I've never had a pet.",,,317,471,2656,2011-07-05 19:13:24+00:00,1
487815529,Lewis Motors,lewis_motors,https://twitter.com/lewis_motors,https://si0.twimg.com/profile_images/3539031671/1db0b605d96cbf9c41c94317b1f8c322_normal.jpeg,,"cabinteely, dublin",http://t.co/VnmxCoHeBr,256,949,404,2012-02-09 19:33:58+00:00,1
6297382,Dermot Casey,dermotcasey,https://twitter.com/dermotcasey,https://si0.twimg.com/profile_images/427726905/avatar-sm_normal.jpg,"Tinstring: growing businesses, strategy & technology. COO/CTO/CEO Lecturer UCD Smurfit. Geek heart, business brain. Start like a hedgehog. Finish like a fox","Dublin, Ireland",http://t.co/3g5XzSZBpQ,3780,1782,31796,2007-05-24 21:57:26+00:00,1
16779119,Anne Marte,nongenderous,https://twitter.com/nongenderous,https://si0.twimg.com/profile_images/378800000083417853/63e52b731ff5579655e50d16c39c131a_normal.jpeg,"Intersectional feminist. I love animals.  Aspie.Vegetarian/wannabe vegan. Can't live without books, wine and coffee.

Instagram: nongenderous",A Pale Blue Dot,,1222,1138,40390,2008-10-15 10:56:18+00:00,1
224169952,Cathie,AnWif,https://twitter.com/AnWif,https://si0.twimg.com/profile_images/1185438336/n597398867_2270507_5420393_normal.jpg,The wif of @JJ5000,Baile Átha Cliath,,22,64,14,2010-12-08 09:37:17+00:00,1
61908561,General Objection,Nerra_Tova,https://twitter.com/Nerra_Tova,https://si0.twimg.com/profile_images/3414036754/5d08f9d095dd82b467b02ca7d0c67001_normal.jpeg,Patron saint of nothing.,"York, Britain",,449,552,10264,2009-07-31 23:54:02+00:00,1
84053627,Lom.j,RealLomj,https://twitter.com/RealLomj,https://si0.twimg.com/profile_images/2142389976/545159_10150610639516176_194861416175_9486063_1534400166_n_normal.jpg,"Rapper and Producer from Lecce!
Ascoltate e commentate sul canale!
Big Up a tutti",Lecce Italy,http://t.co/AdKS3MH6U5,391,1997,837,2009-10-21 10:56:58+00:00,1
2200721,Darragh Doyle,darraghdoyle,https://twitter.com/darraghdoyle,https://si0.twimg.com/profile_images/1254345399/30044_424300565850_587000850_5785042_1884904_n_normal.jpg,"Helps with @ireland, @heartbeatofhome, @riverdance and @LDNIrishComedy. Events blogger in Ireland. Sharer of things found online to make your day better.",Ireland,http://t.co/WFNINe3sZL,20693,4984,98556,2007-03-25 19:29:17+00:00,1
141872302,Mark Salem,Seminaranalyse,https://twitter.com/Seminaranalyse,https://si0.twimg.com/profile_images/1082041470/AfricanSundown_normal.jpg,My life is running according to plan. If only i knew which asshole has the plan to wreck my life.,,,182,1091,8507,2010-05-09 08:10:47+00:00,1
19346525,Megan Price,meganclareprice,https://twitter.com/meganclareprice,https://si0.twimg.com/profile_images/1667593269/dbbacebd-86a9-459d-b008-ad318911996f_normal.png,"Feminist socialist theatre-aholic into social media and social justice. Also likes knitting, baking and the works of Joss Whedon. Unashamed geek.",Cardiff,http://t.co/93vyPjitzR,1170,2002,8916,2009-01-22 16:37:40+00:00,1
481274576,Bee Ni Bee,BeeNiBee,https://twitter.com/BeeNiBee,https://si0.twimg.com/profile_images/378800000475465369/7de6c396336605a3af09319bdcd09b28_normal.png,"A choccie loving, flute playing, avid reading kick @ss",,,182,389,4157,2012-02-02 14:46:36+00:00,1
25965976,Sara Barnard,saramegan,https://twitter.com/saramegan,https://si0.twimg.com/profile_images/3565939367/62ff17a43e67b5c68fd00a4916a7fe0b_normal.png,"Ecommerce manager by day, all round digital enthusiast.   Quaker. Guardianista. Uncategorised feminist. Whovian. Whedonite. Logophile. Big fan of watermelon.",Brighton,,520,379,11876,2009-03-23 06:42:55+00:00,1
18075062,Arthur,arthurCRS,https://twitter.com/arthurCRS,https://si0.twimg.com/profile_images/378800000082106777/a2d09b8655a1c461681cf10d1c633e7f_normal.jpeg,Single mum with the strength of a bear.,Brighton,http://t.co/fj11MmcjJ5,614,680,24007,2008-12-12 12:25:13+00:00,1
104151171,T. Bunny Knits,tbunnyknits,https://twitter.com/tbunnyknits,https://si0.twimg.com/profile_images/1809175920/avatariik_normal.jpg,"http://t.co/1Ksie9sYBO
http://t.co/Tr1Uh23EJU
http://t.co/UxVpZcv9wN",Dublin,http://t.co/2wnTCixtJe,130,170,3306,2010-01-12 12:42:48+00:00,1
480775826,Prenzi Alsine,PrenziX9072,https://twitter.com/PrenziX9072,https://si0.twimg.com/profile_images/1797776494/xx_normal.jpg,loving you hard loving you long,,,108,637,0,2012-02-01 21:57:09+00:00,1
21015148,Adrian Bott,Cavalorn,https://twitter.com/Cavalorn,https://si0.twimg.com/profile_images/78917291/335104_normal.jpeg,Author; mentor; game content creator; narrative consultant; tabletop RPG writer; abuser of semicolons. Did that thing that you read that one time.,Sussex,http://t.co/Yl9p81kUr6,2852,1036,12456,2009-02-16 19:12:56+00:00,1
450545522,Josephine T,legallipstick,https://twitter.com/legallipstick,https://si0.twimg.com/profile_images/1803571212/resized_normal.jpg,Perennial student - recently swapped poetry for law. And lots of lipsticks.,London,http://t.co/nIuyYvP3f1,182,998,1361,2011-12-30 11:00:12+00:00,1
235476300,kevmalo,kevmol88,https://twitter.com/kevmol88,https://si0.twimg.com/profile_images/1794440760/383244_10150482973636247_262842176246_8945691_1749307977_n_normal.jpg,Not in it for the money.,Republic of Ireland,,29,141,327,2011-01-08 08:13:10+00:00,1
381008606,McCambridge's,McCambridges38,https://twitter.com/McCambridges38,https://si0.twimg.com/profile_images/1562589459/shop_with_tables_jul10_small_normal.jpg,"Foodalicious shop and restaurant in Galway city centre, 3rd generation taking things onward and upwards! Natalie McC & Head Chef Heather Flaherty the tweeters!","Shop St. Galway, Ireland",http://t.co/pd2BMWuyK8,1660,561,788,2011-09-27 16:03:07+00:00,1
81918578,kildarestreet.com,KildareStreet,https://twitter.com/KildareStreet,https://si0.twimg.com/profile_images/3761262413/9347123f470f651ccdadf15aee874fc3_normal.jpeg,"Imagine you worked for nothing cleaning a millionaire's poop off his marble floor, and then he slagged you off for it.
We do that for Leinster House staff. Yay",Ireland,http://t.co/SP4e1fuGTF,2960,322,487,2009-10-12 20:18:05+00:00,1
445003574,Nigel  Cheney,NigelCheney,https://twitter.com/NigelCheney,https://si0.twimg.com/profile_images/1715241389/image_normal.jpg,"draws, sews, moans at people",dublin,http://t.co/2kd95ygTAV,98,842,377,2011-12-23 22:13:27+00:00,1
125428078,Orla Murphy,7worldscollide,https://twitter.com/7worldscollide,https://si0.twimg.com/profile_images/378800000426232134/703e41ce2b8ebfa1ae13e6047afb2396_normal.jpeg,"smokes, drinks, swears, rants, questions, laughs, defends those who cannot defend themselves.Thoroughly nice. a bit cracked.",Dublin,,1496,1999,27663,2010-03-22 19:44:41+00:00,1
23964994,Careers At Oracle,CareersAtOracle,https://twitter.com/CareersAtOracle,https://si0.twimg.com/profile_images/2971568612/555128b8b948b6c5b1b5fc68de1d543f_normal.png,"Official news, discussion and learning resources from the Oracle Recruitment team and Oracle Employees around the globe. http://t.co/6LIOdxWKXi",,http://t.co/ePIBRdB5CE,4417,3054,7140,2009-03-12 15:14:43+00:00,1
457411572,Barry Power,DarkenDistance,https://twitter.com/DarkenDistance,https://si0.twimg.com/profile_images/378800000025328192/4bae2a0ceb5e899ba96f5030e878fb64_normal.jpeg,5 Piece alternative band who plays tunes.,Kildare,http://t.co/Cf3tk8ZtcT,507,1950,606,2012-01-07 11:22:19+00:00,1
26460797,Danielle D,Danni2122,https://twitter.com/Danni2122,https://si0.twimg.com/profile_images/3700480290/bd5f0243b8bc7d139517d62a151e0dfa_normal.jpeg,"Lover of all things sparkly, music lover, wine drinker, Clumsy, Giggly, Girlie. Don't be shy, come say hi :)","Dublin, Ireland",,280,457,15158,2009-03-25 09:10:41+00:00,1
17406679,Juleser,juleser,https://twitter.com/juleser,https://si0.twimg.com/profile_images/378800000444120910/aaf2f96586bb3ef89a0c7270ce9cfba4_normal.jpeg,"I'll build your house, sort out your mortgage and make the best damn 'welcome to the neighbourhood' basket you've ever tasted!
**Dubtweetup organiser**","Clogherhead, Drogheda & Dublin",http://t.co/MmzHEkRNbj,1672,1295,71324,2008-11-15 11:55:09+00:00,1
447013730,Vita Cortex Workers,vcortexworkers,https://twitter.com/vcortexworkers,https://si0.twimg.com/profile_images/1717585583/VitaCortexProtestDec11INTERNAL_normal.jpg,"€2.5 Million for 3 Shareholders, €0 for 32 workers, 847 Years Service","Cork, Ireland",http://t.co/qTKk1TqGY7,2364,886,1158,2011-12-26 11:57:17+00:00,1
378222973,Dark Knight,DarkKnightArise,https://twitter.com/DarkKnightArise,https://si0.twimg.com/profile_images/1555155194/george_chap_normal.jpg,*Oxford University *Carroll Foundation *Maryland Charitable Trust = OVERARCH = US HM Crown Ireland Biggest Economic National Security Case.,Washington DC Oxford Ireland ,http://t.co/i3dZsXvz9U,425737,305025,5301,2011-09-22 21:04:49+00:00,1
137637681,Waxbrothers Candles,waxbrothers,https://twitter.com/waxbrothers,https://si0.twimg.com/profile_images/3527779087/941adc8e8913fdfcf51f13815c3cf207_normal.jpeg,"We design and make all our candles. Candles and Supplies, Wholesale also available. 118 Baldoyle ind estate. Dublin 13. 01 8390339 & Tuam. Galway.",Dublin & Galway,http://t.co/B8Ik3kszvL,677,2000,1365,2010-04-27 09:10:05+00:00,1
417808520,Malvina Rangel,Celinejua,https://twitter.com/Celinejua,https://si0.twimg.com/profile_images/1726431959/2063960102Sole_normal.jpg,,Louisiana,http://sex-orgys.net,999,1186,619,2011-11-21 11:50:51+00:00,1
179916761,Aileen Lennon,DelganyDiva,https://twitter.com/DelganyDiva,https://si0.twimg.com/profile_images/1107675767/21-08-2010_10_13_36_normal.JPG,Hormonally-challenged woman with a grudge...,"Delgany - Wicklow, Ireland",,196,482,1760,2010-08-18 12:00:44+00:00,1
456009649,W.J. Kavanagh,WJKavanaghs,https://twitter.com/WJKavanaghs,https://si0.twimg.com/profile_images/2198381837/image_normal.jpg,"Coffee, beer, food, whisk(e)y, gin, and lovely cakes. Opening early 2012.","Dorset Street, Dublin.",http://t.co/FPP0dF9EdW,1829,718,1314,2012-01-05 19:35:47+00:00,1
53172168,poshknacker,poshknacker_1,https://twitter.com/poshknacker_1,https://si0.twimg.com/profile_images/378800000454645460/e874b0e9fe3e9d42932dd6651df223fd_normal.jpeg,I still have dreams that include 'none of the above' on every ballot paper in conjunction with compulsory voting.,"Chapelizod, Dublin, Ireland.",http://t.co/dvuLmn5qpN,1871,586,69405,2009-07-02 20:08:27+00:00,1
266744563,Lorraine Haigney,Lorrrrrrrrraine,https://twitter.com/Lorrrrrrrrraine,https://si0.twimg.com/profile_images/378800000341448029/0491957cf30651e27bb50b8959d88c84_normal.jpeg,"Previously at Confetti, House & Home, Prudence and Beaut.ie. Blogging on John, It's Only Makeup! #Irishbbloggers",Dublin,http://t.co/0vCRIXql26,1144,332,23151,2011-03-15 18:50:17+00:00,1
149135537,Nick McGivney,AdlandIreland,https://twitter.com/AdlandIreland,https://si0.twimg.com/profile_images/989837211/Picture_2_normal.png,"Copywriter, content writer, script doctor, marketing speaker and lecturer.",Dublin,http://t.co/VKM3DzP1V1,1509,1506,1823,2010-05-28 14:14:35+00:00,1
447499713,121depression(2),121depression2,https://twitter.com/121depression2,https://si0.twimg.com/profile_images/1718625749/e31309a5-0d4d-4d92-b07e-b6624f702d5d_normal.jpg,"Welcome to the mirror account of @121depression. You may be redirected here during the course of your chat. It's the same place, the same people...", NOW CLOSED PLEASE SEE INSTEAD,http://t.co/dJEk9LE8Ei,211,412,103,2011-12-26 23:49:30+00:00,1
427742761,Depression Hurts 121,121depression,https://twitter.com/121depression,https://si0.twimg.com/profile_images/1672166898/dph121_normal.jpg,"Founders: @talentcoop @alanceltic
Video  http://t.co/oY5Rl0k1
FREE APP http://t.co/S9SB9K77 
Pinterest  http://t.co/rvknMszK
Facebook https://t.co/dX05k80T",UK/Ireland 24/7 365 support,http://t.co/lByXxBwo,1111,1013,1578,2011-12-03 22:37:20+00:00,1
258064205,Ciara,CiHarb,https://twitter.com/CiHarb,https://si0.twimg.com/profile_images/1274765347/twitterpic2_normal.jpg,"It's all part of the adventure, Person, Wife, Mum, Sister, Friend, Palliative Care Nurse, Tree-hugger , imaginary superhero, trying to make life easier.",,,467,1126,9786,2011-02-26 21:54:49+00:00,1
440201443,DublinPerv,DublinPerv,https://twitter.com/DublinPerv,https://si0.twimg.com/profile_images/1700596284/twitter_image_normal.jpg,Perv in Dublin. Go on - dare to follow. only slightly nsfw,"Dublin, Ireland",,338,1946,1288,2011-12-18 18:02:03+00:00,1
53227205,C,bord2is,https://twitter.com/bord2is,https://si0.twimg.com/profile_images/2340474354/pf8d8j2d20h5nnwkq07n_normal.jpeg,,Ireland,,243,853,10574,2009-07-02 23:39:53+00:00,1
121884018,William Hyland,williamshyland,https://twitter.com/williamshyland,https://si0.twimg.com/profile_images/378800000457692601/fb2a81cc760a8f7c3e0a589283f49c77_normal.jpeg,".I am still & Video photographer . I film. I edit. I tell stories and i am a volunteer with special olympic ireland 
All views are my own.",dublin & wicklow ,http://t.co/bB4FstOmph,341,1842,2408,2010-03-10 22:43:34+00:00,1
326182807,Robbie@LinkedIn,robbiemcgonnell,https://twitter.com/robbiemcgonnell,https://si0.twimg.com/profile_images/378800000076834527/17bfb8b3875e8f8afcdb27179053d110_normal.jpeg,"Helping Agencies in UK & Ireland attract top #talent via @LinkedIn MUFC fan, love film, literature, travel, #recruitment nerd",LinkedIn Dublin,http://t.co/PpHp98qrzn,1037,2001,4092,2011-06-29 14:23:58+00:00,1
202992599,Barefooted Family,BarefootedFam,https://twitter.com/BarefootedFam,https://si0.twimg.com/profile_images/1208198819/e9c52eb3-c3fe-4fec-aca0-a38971aa6828_normal.png,"UCing, VBAC, APing, HSing,  mama of 4. Husband says I'm not funny but I totally am.","fairbanks, alaska",http://t.co/AcKMmoNSjB,455,536,3225,2010-10-15 08:35:52+00:00,1
377792215,Naomi Fuller,stylemykitty,https://twitter.com/stylemykitty,https://si0.twimg.com/profile_images/1554111920/Emo_Hairstyle_girl_2__1__normal.jpg,"Summertime, when the livin's easy",,,340,1989,1250,2011-09-22 03:34:22+00:00,1
19389003,Patrick Horgan,superflyninja,https://twitter.com/superflyninja,https://si0.twimg.com/profile_images/1351853343/My_Left_Eye2_by_superflyninja_normal.jpg,"I develop android games, take photos and live in Dublin with my three girls  :D",Dublin,http://t.co/dKw7NyuB64,130,412,1338,2009-01-23 10:19:05+00:00,1
47101231,Jay,y2jayfox,https://twitter.com/y2jayfox,https://si0.twimg.com/profile_images/3192238567/1970923af26cdf19b8bea18b4a7c1a4f_normal.jpeg,"Running an independent drinks store in Wicklow. Lover of Wine, Craft Beers, Spirits and Cocktails. All tweets are my view.","Wicklow, Ireland",,1464,999,30911,2009-06-14 14:35:09+00:00,1
57437772,Barry Walsh,thelinden,https://twitter.com/thelinden,https://si0.twimg.com/profile_images/3614337761/f56bb57cab2db94d06289679ffe84319_normal.jpeg,Web frontend & backend developer & designer from Wexford living in Dublin city.  Ex-DCU Multimedian.,Dublin,http://t.co/rl548o5Z5f,461,1197,4922,2009-07-16 20:30:41+00:00,1
25895905,Lee Tobin,lept,https://twitter.com/lept,https://si0.twimg.com/profile_images/1165065829/leeface_normal.jpg,"Obsessive, Composer, Developer.",Ireland,http://t.co/lg6uI3dQHI,152,222,516,2009-03-22 22:35:35+00:00,1
82936534,Olga NíGíorra,fit_gurl,https://twitter.com/fit_gurl,https://si0.twimg.com/profile_images/378800000068641453/b25df06c2edf18a05da7a57bdf601bd1_normal.jpeg,"Girl Loves Girls, I.T/Network Security & Forensics, Written Word, Music, Art, Good Food, Blogging and life in general. :)","Dublin, ireland",http://t.co/dd8fIYN6Zm,627,949,20697,2009-10-16 18:05:17+00:00,1
68041612,LadyUmbrella,ladyumbrellaltd,https://twitter.com/ladyumbrellaltd,https://si0.twimg.com/profile_images/545667169/Red_Umbrella_Logo_normal.jpg,"Hello tweeps, I'm Rob and work with brand new and exciting designer range of cool and quirky ladies t-shirts called LadyUmbrella...I love jellies!","Dublin, Ireland",http://t.co/7ha0NvJuVW,7279,8579,53383,2009-08-23 01:50:15+00:00,1
208545373,Sinead Cray,SigmaDrivingSch,https://twitter.com/SigmaDrivingSch,https://si0.twimg.com/profile_images/1178321049/adi_logo_normal.jpg,"Approved driving instructor.  Teaching good driving habits & driving skills - for life, not just for the test.",Dublin,http://t.co/xMAk2qZ0cg,140,494,742,2010-10-27 13:37:11+00:00,1
434871158,Good Seed PR,GoodSeedPR,https://twitter.com/GoodSeedPR,https://si0.twimg.com/profile_images/1688859363/GoodSeedPR.com_normal.jpg,Music PR: Marilyn Manson//The Cult/Suzanne Vega/Underworld/Senakah/ Hot Sprockets/ Duran Duran/ Madness/Red Bull Records/ Cooking Vinyl/ Eleanor McEvoy etc...,Meath/Dublin/ Ireland,http://t.co/ROaOSuXy7o,1126,1997,2925,2011-12-12 12:17:39+00:00,1
17350506,Anna Purdy,annapurdy,https://twitter.com/annapurdy,https://si0.twimg.com/profile_images/3338797990/fa3a3a3724656e5bf3d065a2b867022d_normal.jpeg,"Masticator. Provost of the written word. I'm way into you, man.",Louisiana,http://t.co/dkgsA77HIZ,653,716,8169,2008-11-12 22:24:53+00:00,1
14264034,Burtsquiat,burts,https://twitter.com/burts,https://si0.twimg.com/profile_images/378800000394043014/bf9cdffb3c7a1fe9b92283dd2a47a4a6_normal.jpeg,"so why see the world, when you got the beach",michigoon,,453,176,68827,2008-03-31 06:25:19+00:00,1
380924583,OccupyEire,OccupyDublin,https://twitter.com/OccupyDublin,https://si0.twimg.com/profile_images/1564274809/wallst-250-3__1__normal.jpg,#OccupyDublin in solidarity with #OccupyWallStreet. We want a fair and equal society not one that favours the few. Our message is Worldwide. We are the 99%,Ireland,http://t.co/1WD04OYcod,5988,2310,18539,2011-09-27 13:21:49+00:00,1
430837896,Alice,Sweary_Poppins,https://twitter.com/Sweary_Poppins,https://si0.twimg.com/profile_images/378800000447039856/225815baa83d005ba21a33ef66acbd36_normal.jpeg,"Feminist, lefty, sweary, bookworm, geek, Whooligan, crafty, music-lover, cheddar-lover. Oft cross, oft away with the fairies. Daughter of @angryinmayo",Dublin,,508,712,7485,2011-12-07 16:35:35+00:00,1
414092381,Throwing Shapes,_ThrowingShapes,https://twitter.com/_ThrowingShapes,https://si0.twimg.com/profile_images/1681504628/Logo_Animated_normal.gif,"We design T-Shirts to Love in, Sweat in, Laugh in, Party in and Throw Shapes in... Where do you throw shapes?",,,41,158,34,2011-11-16 16:32:52+00:00,1
389444489,Rosalee Shore,RosaleeShore,https://twitter.com/RosaleeShore,https://si0.twimg.com/profile_images/1674983272/images189_normal.jpg,,,,160,526,26428,2011-10-12 12:46:28+00:00,1
428528706,Ciaran Doyle,sfbg1971,https://twitter.com/sfbg1971,https://si0.twimg.com/profile_images/1724267533/I8Q0Tz98_normal,,,,6,4,2,2011-12-04 21:41:19+00:00,1
16905947,Fintan Murphy,fintanmurphy,https://twitter.com/fintanmurphy,https://si0.twimg.com/profile_images/2633663279/7da9ce9a5ac6dafa45ce194dc49db408_normal.jpeg,"Founder of @damsoncloud. Entrepreneur, Adventurer, Vegan, Extreme Sports junkie, Family Man...Future Billionaire.",Dublin & London,http://t.co/WXpcqYEnPf,1211,1108,10429,2008-10-22 14:21:16+00:00,1
22700048,Eimear McCormack,EimearMcCormack,https://twitter.com/EimearMcCormack,https://si0.twimg.com/profile_images/378800000439336678/49245f52f4f750b89ccf6038dff738f6_normal.jpeg,"MD of @BDifferentIE & CMO of iTagged. I love #startups #tech, #sports #broadcasting & #eventspeaking. Email me: eimear@bdifferent.ie",Baile Átha Cliath | Mhaigh Eo,http://t.co/u6N1m8xqKt,3797,4144,37847,2009-03-03 23:32:55+00:00,1
24508623,Marcais,IrelandUncut,https://twitter.com/IrelandUncut,https://si0.twimg.com/profile_images/3452332135/526094c91dd5a7b21d544f435368133f_normal.jpeg,The views expressed here are entirely those of...the voices...can you hear them too?,#J4TF #Fiannafailzheimers,http://t.co/f5iJZg75m5,3112,3049,46798,2009-03-15 10:28:23+00:00,1
403178309,Zombie Ireland,zombieireland,https://twitter.com/zombieireland,https://si0.twimg.com/profile_images/2296590447/ouxwsfxdetxoml98x6mo_normal.png,Can you survive the zombie apocalypse?,Ireland,,106,167,905,2011-11-02 03:57:58+00:00,1
187335303,GoCreate Marketing,MarketingGC,https://twitter.com/MarketingGC,https://si0.twimg.com/profile_images/1205743655/mark_normal.png,"We help Businesses with their Digital Marketing & Social Media needs. Contact us today! 
Download 2 eBooks & get Video TRAINING for FREE from our website!","Dublin, Ireland",http://t.co/UP4S2mxmpF,6186,4933,975,2010-09-05 23:19:36+00:00,1
176539546,Carol Tobin,CarolGertrude,https://twitter.com/CarolGertrude,https://si0.twimg.com/profile_images/3771115981/81f07fab3190ba922946bc810fc63931_normal.jpeg,"Comedian & writer living the nightmare. I asked for a pony, I got a clothes horse.",SomewhereDownTheCrazyRiver,http://t.co/yPnfNyrDBj,4066,1168,22995,2010-08-09 20:25:20+00:00,1
364423505,Thendra Michaels,styyleforever,https://twitter.com/styyleforever,https://si0.twimg.com/profile_images/1519382075/d4307i93453h175105_normal.jpg,"Life is like hair, free and mysterious.",,,308,1979,1134,2011-08-29 19:01:05+00:00,1
17602747,Project Arts Centre,projectarts,https://twitter.com/projectarts,https://si0.twimg.com/profile_images/2459367573/yhht4co5dju3wndli60j_normal.jpeg,"More than a venue. ...You never know what to expect...” Lonely Planet. Theatre, music, dance & visual arts all at Dublin's busiest Arts Centre","Dublin, Ireland.",http://t.co/OPzGE9DrYB,11216,1652,12008,2008-11-24 22:12:22+00:00,1
418637795,Street_Heart,StreetHeart_,https://twitter.com/StreetHeart_,https://si0.twimg.com/profile_images/1651876724/Street_Heart_Logo_FB_normal.jpg,Urban creatives helping Ireland's homeless.,"Dublin, Ireland",,84,359,88,2011-11-22 12:06:24+00:00,1
121482336,James Keating,landsleaving,https://twitter.com/landsleaving,https://si0.twimg.com/profile_images/3526315354/ff3d979dd6eef0473ee89f23ee4a699e_normal.jpeg,"Documentary Filmmaker and Radio presenter/producer. Host of The Time Traveller's Survival Guide, Mondays at 7pm, RTE Junior Radio.","Dublin, Ireland",http://t.co/srJGIaf6Hv,524,1408,2237,2010-03-09 16:51:22+00:00,1
21688057,Niamh Pitts,NiamhPitts,https://twitter.com/NiamhPitts,https://si0.twimg.com/profile_images/378800000501066942/4b4dfbe5517d21cc3251852d9f509900_normal.jpeg,,,,1294,999,51488,2009-02-23 20:12:16+00:00,1
329960084,John Walsh,JohnnyWestCoast,https://twitter.com/JohnnyWestCoast,https://si0.twimg.com/profile_images/3299185038/a1805fe607d77774f4c97f152e49595d_normal.jpeg,"Mostly tech, creative & digital. Co-Founder @VideoScamp . Photographer, Surfer, and former sword slinging sales assassin.",Dublin,,714,1449,1144,2011-07-05 21:53:08+00:00,1
94138658,Aoif H,aoifh,https://twitter.com/aoifh,https://si0.twimg.com/profile_images/3135706473/40827087f3fd38e2aeba6b86be5ca7c7_normal.jpeg,"Galway girl, working in PR, living in Dublin with my partner in crime @pete_mce. All views my own and not of my employer!",Dublin,,162,478,2140,2009-12-02 17:57:51+00:00,1
211908348,How 2.0,How2_0,https://twitter.com/How2_0,https://si0.twimg.com/profile_images/1159631964/How_2.0___Market_your_business_Online_normal.jpg,How 2.0 Market Your Business Online. a twice yearly conference. Next is March 2012 in Dublin.,"Dublin, Ireland",http://t.co/m4uvSzpLGz,538,1074,763,2010-11-04 16:24:35+00:00,1
358881661,All About nU,AllAboutnU,https://twitter.com/AllAboutnU,https://si0.twimg.com/profile_images/1636803774/Twitter_pic_normal.JPG,"Real nutrition, real lives","Dublin, Ireland",http://t.co/jzfOUyTqIJ,15,49,5,2011-08-20 17:20:36+00:00,1
84702049,Kirstie Jones,Kirstiejjones,https://twitter.com/Kirstiejjones,https://si0.twimg.com/profile_images/1173159732/me1_normal.jpg,"Part time legal assistant for a fantastic family lawyer from Woolley & Co. Wife, mother and dog and animal lover!","Crick, Northants",,87,562,528,2009-10-23 22:09:15+00:00,1
7653312,Eric Nieudan,e_eric,https://twitter.com/e_eric,https://si0.twimg.com/profile_images/3621463946/3d9d7ac7f047d462f501c65202007a8c_normal.jpeg,"Will turn pixels into stories. For cheese.
(French tweets @surcapitaine)",Dublin,http://t.co/MVSSFBXUti,711,396,10530,2007-07-23 06:13:23+00:00,1
385854820,Mike D,MountOliveMike,https://twitter.com/MountOliveMike,https://si0.twimg.com/profile_images/3136725390/93bb30f539b66f3c7ab27f62ffc5d115_normal.jpeg,"male, single, unemployed",,,367,1982,77,2011-10-06 07:47:56+00:00,1
42437860,Elaine O'Brien,Mozgal82,https://twitter.com/Mozgal82,https://si0.twimg.com/profile_images/378800000434579775/2fa1003a084f7bebf7efe26192977538_normal.jpeg,FashionAMeBay & mummy to Zara* Horror Music Animals Food Vin Rouge, Dublin ,,357,378,2365,2009-05-25 16:42:30+00:00,1
359410634,oonagh staunton,stauntoo,https://twitter.com/stauntoo,https://si0.twimg.com/profile_images/2231039721/PvXhQYet_normal,,Dublin,,40,174,500,2011-08-21 14:58:17+00:00,1
